action,post_id,slug,title,origin,field,meta_key,label_status,before_snippet,after_snippet
planned_update,37439,the-body-shop-skin-defence-multi-protection-lotion-spf50-60ml,"The body Shop Skin Defence Multi-protection Lotion Spf 50+pa++++ 40ml",UK,post_excerpt,,origin_specific_safe_text,"Buy The body Shop Skin Defence Multi-protection Lotion Spf 50+pa++++ 40ml in Bangladesh. 100% authentic Korea import. Dhaka 1-2 days delivery. COD available at Emart Skincare Ba...","Buy The body Shop Skin Defence Multi-protection Lotion Spf 50+pa++++ 40ml in Bangladesh. 100% authentic UK-origin product. Dhaka 1-2 days delivery. COD available at Emart Skinca..."
planned_update,37442,the-body-shop-roots-of-strength-firming-shaping-cream-50ml,"The Body Shop Roots Of Strength Firming Shaping Cream 50ml",UK,post_content,,origin_specific_safe_text,"Korean skincare has always been a favorite among beauty enthusiasts, and after testing numerous products, we‚Äôre excited to introduce ""The Body Shop Roots Of Strength Firming S...","Korean skincare has always been a favorite among beauty enthusiasts, and after testing numerous products, we‚Äôre excited to introduce ""The Body Shop Roots Of Strength Firming S..."
planned_update,37442,the-body-shop-roots-of-strength-firming-shaping-cream-50ml,"The Body Shop Roots Of Strength Firming Shaping Cream 50ml",UK,post_excerpt,,origin_specific_safe_text,"Buy The Body Shop Roots Of Strength Firming Shaping Cream 50ml in Bangladesh. 100% authentic Korea import. Dhaka 1-2 days delivery. COD available at Emart Skincare Bangladesh.","Buy The Body Shop Roots Of Strength Firming Shaping Cream 50ml in Bangladesh. 100% authentic UK-origin product. Dhaka 1-2 days delivery. COD available at Emart Skincare Bangladesh."
planned_update,37448,the-body-shop-pomegranate-firming-day-cream-50ml,"The Body Shop Pomegranate Firming Day Cream 50ml",UK,post_content,,origin_specific_safe_text,"Bangladesh's climate and skin concerns have been kept in mind while bringing this product to you. The Body Shop Pomegranate Firming Day Cream is a skincare essential designed to...","Bangladesh's climate and skin concerns have been kept in mind while bringing this product to you. The Body Shop Pomegranate Firming Day Cream is a skincare essential designed to..."
planned_update,37448,the-body-shop-pomegranate-firming-day-cream-50ml,"The Body Shop Pomegranate Firming Day Cream 50ml",UK,post_excerpt,,origin_specific_safe_text,"Buy The Body Shop Pomegranate Firming Day Cream 50ml in Bangladesh. 100% authentic Korea import. Dhaka 1-2 days delivery. COD available at Emart Skincare Bangladesh.","Buy The Body Shop Pomegranate Firming Day Cream 50ml in Bangladesh. 100% authentic UK-origin product. Dhaka 1-2 days delivery. COD available at Emart Skincare Bangladesh."
planned_update,37452,the-body-shop-aloe-moisturizing-day-cream-50ml,"THE BODY SHOP Aloe Moisturizing Day Cream 50ml",UK,post_excerpt,,origin_specific_safe_text,"Buy THE BODY SHOP Aloe Moisturizing Day Cream 50ml in Bangladesh. 100% authentic Korea import. Dhaka 1-2 days delivery. COD available at Emart Skincare Bangladesh.","Buy THE BODY SHOP Aloe Moisturizing Day Cream 50ml in Bangladesh. 100% authentic UK-origin product. Dhaka 1-2 days delivery. COD available at Emart Skincare Bangladesh."
planned_update,37455,the-body-shop-seaweed-oil-control-gel-cream-50ml,"The Body shop Seaweed Oil Control Gel Cream 50ml",UK,post_content,,origin_specific_safe_text,"Honestly, we‚Äôre quite impressed with this product. Living in Dhaka, where humidity, heat, and pollution can wreak havoc on our skin, finding a skincare product that balances o...","Honestly, we‚Äôre quite impressed with this product. Living in Dhaka, where humidity, heat, and pollution can wreak havoc on our skin, finding a skincare product that balances o..."
planned_update,37455,the-body-shop-seaweed-oil-control-gel-cream-50ml,"The Body shop Seaweed Oil Control Gel Cream 50ml",UK,post_excerpt,,origin_specific_safe_text,"Buy The Body shop Seaweed Oil Control Gel Cream 50ml in Bangladesh. 100% authentic Korea import. Dhaka 1-2 days delivery. COD available at Emart Skincare Bangladesh.","Buy The Body shop Seaweed Oil Control Gel Cream 50ml in Bangladesh. 100% authentic UK-origin product. Dhaka 1-2 days delivery. COD available at Emart Skincare Bangladesh."
planned_update,37459,the-body-shop-vitamin-e-nourishing-night-cream-72h-50ml,"The Body Shop Vitamin E Nourishing Night Cream 72H 50ml",UK,post_excerpt,,origin_specific_safe_text,"Buy The Body Shop Vitamin E Nourishing Night Cream 72H 50ml in Bangladesh. 100% authentic Korea import. Dhaka 1-2 days delivery. COD available at Emart Skincare Bangladesh.","Buy The Body Shop Vitamin E Nourishing Night Cream 72H 50ml in Bangladesh. 100% authentic UK-origin product. Dhaka 1-2 days delivery. COD available at Emart Skincare Bangladesh."
planned_update,37462,the-body-shop-vitamin-c-glow-boosting-moisturiser-50ml,"The Body Shop Vitamin C Glow Boosting Moisturiser 50ml",UK,post_content,,origin_specific_safe_text,"Considering the climate and skin needs in Bangladesh, this product has been thoughtfully introduced. The Body Shop Vitamin C Glow Boosting Moisturiser is a fresh, lightweight fa...","Considering the climate and skin needs in Bangladesh, this product has been thoughtfully introduced. The Body Shop Vitamin C Glow Boosting Moisturiser is a fresh, lightweight fa..."
planned_update,37462,the-body-shop-vitamin-c-glow-boosting-moisturiser-50ml,"The Body Shop Vitamin C Glow Boosting Moisturiser 50ml",UK,post_excerpt,,origin_specific_safe_text,"Buy The Body Shop Vitamin C Glow Boosting Moisturiser 50ml in Bangladesh. 100% authentic Korea import. Dhaka 1-2 days delivery. COD available at Emart Skincare Bangladesh.","Buy The Body Shop Vitamin C Glow Boosting Moisturiser 50ml in Bangladesh. 100% authentic UK-origin product. Dhaka 1-2 days delivery. COD available at Emart Skincare Bangladesh."
planned_update,37465,the-body-shop-tea-tree-oil-20ml,"The Body Shop Tea Tree Oil 20ml",UK,post_excerpt,,origin_specific_safe_text,"Buy The Body Shop Tea Tree Oil 20ml in Bangladesh. 100% authentic Korea import. Dhaka 1-2 days delivery. COD available at Emart Skincare Bangladesh.","Buy The Body Shop Tea Tree Oil 20ml in Bangladesh. 100% authentic UK-origin product. Dhaka 1-2 days delivery. COD available at Emart Skincare Bangladesh."
planned_update,37468,the-body-shop-tea-tree-anti-imperfection-solution-50-ml,"The Body Shop Tea Tree Anti-Imperfection Solution 50 ml",UK,post_excerpt,,origin_specific_safe_text,"Buy The Body Shop Tea Tree Anti-Imperfection Solution 50 ml in Bangladesh. 100% authentic Korea import. Dhaka 1-2 days delivery. COD available at Emart Skincare Bangladesh.","Buy The Body Shop Tea Tree Anti-Imperfection Solution 50 ml in Bangladesh. 100% authentic UK-origin product. Dhaka 1-2 days delivery. COD available at Emart Skincare Bangladesh."
planned_update,37471,the-body-shop-tea-tree-night-lotion-30ml,"The Body Shop Tea Tree Night Lotion 30ml",UK,post_excerpt,,origin_specific_safe_text,"Buy The Body Shop Tea Tree Night Lotion 30ml in Bangladesh. 100% authentic Korea import. Dhaka 1-2 days delivery. COD available at Emart Skincare Bangladesh.","Buy The Body Shop Tea Tree Night Lotion 30ml in Bangladesh. 100% authentic UK-origin product. Dhaka 1-2 days delivery. COD available at Emart Skincare Bangladesh."
planned_update,37474,the-body-shop-fresh-raspberry-hydrating-body-mist-100ml,"The Body Shop Fresh Raspberry Hydrating Body Mist 100ml",UK,post_content,,origin_specific_safe_text,"Dhaka's hot and humid weather makes skincare a daily challenge. The intense heat combined with pollution can leave your skin feeling dry, sticky, and dull. That's where The Body...","Dhaka's hot and humid weather makes skincare a daily challenge. The intense heat combined with pollution can leave your skin feeling dry, sticky, and dull. That's where The Body..."
planned_update,37474,the-body-shop-fresh-raspberry-hydrating-body-mist-100ml,"The Body Shop Fresh Raspberry Hydrating Body Mist 100ml",UK,post_excerpt,,origin_specific_safe_text,"Buy The Body Shop Fresh Raspberry Hydrating Body Mist 100ml in Bangladesh. 100% authentic Korea import. Dhaka 1-2 days delivery. COD available at Emart Skincare Bangladesh.","Buy The Body Shop Fresh Raspberry Hydrating Body Mist 100ml in Bangladesh. 100% authentic UK-origin product. Dhaka 1-2 days delivery. COD available at Emart Skincare Bangladesh."
planned_update,37477,the-body-shop-drops-of-light-pure-resurfacing-liquid-peel-100ml,"The Body Shop Drops of Light Pure Resurfacing Liquid Peel 100ml",UK,post_excerpt,,origin_specific_safe_text,"Buy The Body Shop Drops of Light Pure Resurfacing Liquid Peel 100ml in Bangladesh. 100% authentic Korea import. Dhaka 1-2 days delivery. COD available at Emart Skincare Bangladesh.","Buy The Body Shop Drops of Light Pure Resurfacing Liquid Peel 100ml in Bangladesh. 100% authentic UK-origin product. Dhaka 1-2 days delivery. COD available at Emart Skincare Ban..."
planned_update,37480,the-body-shop-tea-tree-iconic-oil-collections-3-peice-3x-10ml,"The Body Shop Tea Tree Iconic Oil Collections 3 Peice 3x 10ml",UK,post_excerpt,,origin_specific_safe_text,"Buy The Body Shop Tea Tree Iconic Oil Collections 3 Peice 3x 10ml in Bangladesh. 100% authentic Korea import. Dhaka 1-2 days delivery. COD available at Emart Skincare Bangladesh.","Buy The Body Shop Tea Tree Iconic Oil Collections 3 Peice 3x 10ml in Bangladesh. 100% authentic UK-origin product. Dhaka 1-2 days delivery. COD available at Emart Skincare Bangl..."
planned_update,37483,the-body-shop-tea-tree-targeted-gel-5-x-2-5ml,"The Body Shop Tea Tree Targeted Gel 5 x 2.5ml",UK,post_excerpt,,origin_specific_safe_text,"Buy The Body Shop Tea Tree Targeted Gel 5 x 2.5ml in Bangladesh. 100% authentic Korea import. Dhaka 1-2 days delivery. COD available at Emart Skincare Bangladesh.","Buy The Body Shop Tea Tree Targeted Gel 5 x 2.5ml in Bangladesh. 100% authentic UK-origin product. Dhaka 1-2 days delivery. COD available at Emart Skincare Bangladesh."
planned_update,37487,the-body-shop-lightening-shade-adjusting-drops-15ml,"The Body Shop Lightening Shade Adjusting Drops 15ml",UK,post_excerpt,,origin_specific_safe_text,"Buy The Body Shop Lightening Shade Adjusting Drops 15ml in Bangladesh. 100% authentic Korea import. Dhaka 1-2 days delivery. COD available at Emart Skincare Bangladesh.","Buy The Body Shop Lightening Shade Adjusting Drops 15ml in Bangladesh. 100% authentic UK-origin product. Dhaka 1-2 days delivery. COD available at Emart Skincare Bangladesh."
planned_update,37519,nivea-men-fresh-face-body-hand-gel-75ml,"Nivea Men Fresh Face, Body Hand Gel 75ml",Germany,post_excerpt,,origin_specific_safe_text,"Buy Nivea Men Fresh Face, Body Hand Gel 75ml in Bangladesh. 100% authentic Korea import. Dhaka 1-2 days delivery. COD available at Emart Skincare Bangladesh.","Buy Nivea Men Fresh Face, Body Hand Gel 75ml in Bangladesh. 100% authentic German product. Dhaka 1-2 days delivery. COD available at Emart Skincare Bangladesh."
planned_update,37536,bioderma-node-p-anti-dandruff-purifying-shampoo-400ml,"Bioderma Nod√© P Anti-Dandruff Purifying Shampoo 400ml",France,post_content,,origin_specific_safe_text,"Korean skincare-‡¶è‡¶∞ ‡¶Ö‡¶®‡ßá‡¶ï ‡¶™‡¶£‡ßç‡¶Ø test ‡¶ï‡¶∞‡¶æ‡¶∞ ‡¶™‡¶∞ ‡¶è‡¶ü‡¶æ ‡¶Ü‡¶Æ‡¶æ‡¶¶‡ßá‡¶∞ catalog-‡¶è ‡¶è‡¶∏‡ßá‡¶õ‡ßá‡•§ Bioderma Nod√© P Anti-Dandruff Purifying Sh...","Korean skincare-‡¶è‡¶∞ ‡¶Ö‡¶®‡ßá‡¶ï ‡¶™‡¶£‡ßç‡¶Ø test ‡¶ï‡¶∞‡¶æ‡¶∞ ‡¶™‡¶∞ ‡¶è‡¶ü‡¶æ ‡¶Ü‡¶Æ‡¶æ‡¶¶‡ßá‡¶∞ catalog-‡¶è ‡¶è‡¶∏‡ßá‡¶õ‡ßá‡•§ Bioderma Nod√© P Anti-Dandruff Purifying Sh..."
planned_update,37549,seba-med-anti-hairloss-shampoo-200ml,"Seba Med Anti Hairloss Shampoo 200ml",Germany,post_content,,origin_specific_safe_text,"One of our customers first mentioned this product to us, and after hearing about their positive experience, the Emart team personally verified its effectiveness. Introducing the...","One of our customers first mentioned this product to us, and after hearing about their positive experience, the Emart team personally verified its effectiveness. Introducing the..."
planned_update,37549,seba-med-anti-hairloss-shampoo-200ml,"Seba Med Anti Hairloss Shampoo 200ml",Germany,post_excerpt,,origin_specific_safe_text,"Buy Seba Med Anti Hairloss Shampoo 200ml in Bangladesh. 100% authentic Korea import. Dhaka 1-2 days delivery. COD available at Emart Skincare Bangladesh.","Buy Seba Med Anti Hairloss Shampoo 200ml in Bangladesh. 100% authentic German product. Dhaka 1-2 days delivery. COD available at Emart Skincare Bangladesh."
planned_update,37558,seba-med-anti-dandruff-shampoo-200ml,"Seba Med Anti Dandruff Shampoo 200ml",Germany,post_content,,origin_specific_safe_text,"Dhaka‚Äôs hot and humid weather makes it challenging to take care of your skin and scalp. Dandruff, itchiness, and irritation often worsen in such conditions, leaving you frustr...","Dhaka‚Äôs hot and humid weather makes it challenging to take care of your skin and scalp. Dandruff, itchiness, and irritation often worsen in such conditions, leaving you frustr..."
planned_update,37558,seba-med-anti-dandruff-shampoo-200ml,"Seba Med Anti Dandruff Shampoo 200ml",Germany,post_excerpt,,origin_specific_safe_text,"Buy Seba Med Anti Dandruff Shampoo 200ml in Bangladesh. 100% authentic Korea import. Dhaka 1-2 days delivery. COD available at Emart Skincare Bangladesh.","Buy Seba Med Anti Dandruff Shampoo 200ml in Bangladesh. 100% authentic German product. Dhaka 1-2 days delivery. COD available at Emart Skincare Bangladesh."
planned_update,37572,nivea-pure-natural-soothing-day-cream-50ml,"Nivea Pure & Natural Soothing Day Cream 50ml",Germany,post_excerpt,,origin_specific_safe_text,"Buy Nivea Pure &amp; Natural Soothing Day Cream 50ml in Bangladesh. 100% authentic Korea import. Dhaka 1-2 days delivery. COD available at Emart Skincare Bangladesh.","Buy Nivea Pure &amp; Natural Soothing Day Cream 50ml in Bangladesh. 100% authentic German product. Dhaka 1-2 days delivery. COD available at Emart Skincare Bangladesh."
planned_update,37582,nivea-for-men-creme-intensieve-50ml,"Nivea For Men Creme Intensieve 50ml",Germany,post_excerpt,,origin_specific_safe_text,"Buy Nivea For Men Creme Intensieve 50ml in Bangladesh. 100% authentic Korea import. Dhaka 1-2 days delivery. COD available at Emart Skincare Bangladesh.","Buy Nivea For Men Creme Intensieve 50ml in Bangladesh. 100% authentic German product. Dhaka 1-2 days delivery. COD available at Emart Skincare Bangladesh."
planned_update,37597,nivea-soft-moisturizing-cream-300ml,"Nivea Soft Moisturizing Cream 300ml",Germany,post_excerpt,,origin_specific_safe_text,"Buy Nivea Soft Moisturizing Cream 300ml in Bangladesh. 100% authentic Korea import. Dhaka 1-2 days delivery. COD available at Emart Skincare Bangladesh.","Buy Nivea Soft Moisturizing Cream 300ml in Bangladesh. 100% authentic German product. Dhaka 1-2 days delivery. COD available at Emart Skincare Bangladesh."
planned_update,37698,sebamed-after-shave-balsam-100ml,"Sebamed After Shave Balsam 100ml`",Germany,post_content,,origin_specific_safe_text,"Korean skincare has always been renowned for its gentle yet effective formulas, and after testing numerous products, the Sebamed After Shave Balsam has earned its place in our E...","Korean skincare has always been renowned for its gentle yet effective formulas, and after testing numerous products, the Sebamed After Shave Balsam has earned its place in our E..."
planned_update,37698,sebamed-after-shave-balsam-100ml,"Sebamed After Shave Balsam 100ml`",Germany,post_excerpt,,origin_specific_safe_text,"Buy Sebamed After Shave Balsam 100ml` in Bangladesh. 100% authentic Korea import. Dhaka 1-2 days delivery. COD available at Emart Skincare Bangladesh.","Buy Sebamed After Shave Balsam 100ml` in Bangladesh. 100% authentic German product. Dhaka 1-2 days delivery. COD available at Emart Skincare Bangladesh."
planned_update,37718,palmers-cocoa-butter-with-vitamin-e-moisturizer-200ge,"Palmers Cocoa Butter With Vitamin E Moisturizer 200ge",USA,post_excerpt,,origin_specific_safe_text,"Buy Palmers Cocoa Butter With Vitamin E Moisturizer 200ge in Bangladesh. 100% authentic Korea import. Dhaka 1-2 days delivery. COD available at Emart Skincare Bangladesh.","Buy Palmers Cocoa Butter With Vitamin E Moisturizer 200ge in Bangladesh. 100% authentic USA-origin product. Dhaka 1-2 days delivery. COD available at Emart Skincare Bangladesh."
planned_update,37725,palmers-skin-success-anti-dark-spot-fade-cream-75ml,"Palmers Skin Success Anti-Dark Spot Fade Cream 75ml",USA,post_excerpt,,origin_specific_safe_text,"Buy Palmers Skin Success Anti-Dark Spot Fade Cream 75ml in Bangladesh. 100% authentic Korea import. Dhaka 1-2 days delivery. COD available at Emart Skincare Bangladesh.","Buy Palmers Skin Success Anti-Dark Spot Fade Cream 75ml in Bangladesh. 100% authentic USA-origin product. Dhaka 1-2 days delivery. COD available at Emart Skincare Bangladesh."
planned_update,37728,palmers-skin-success-anti-dark-spot-night-time-fade-cream-75ml,"Palmers Skin Success Anti-Dark Spot Night Time Fade Cream 75ml",USA,post_excerpt,,origin_specific_safe_text,"Buy Palmers Skin Success Anti-Dark Spot Night Time Fade Cream 75ml in Bangladesh. 100% authentic Korea import. Dhaka 1-2 days delivery. COD available at Emart Skincare Bangladesh.","Buy Palmers Skin Success Anti-Dark Spot Night Time Fade Cream 75ml in Bangladesh. 100% authentic USA-origin product. Dhaka 1-2 days delivery. COD available at Emart Skincare Ban..."
planned_update,37735,palmers-cocoa-butter-formula-scar-serum-30ml,"Palmers Cocoa & Butter Formula Scar Serum 30ml",USA,post_excerpt,,origin_specific_safe_text,"Buy Palmers Cocoa &amp; Butter Formula Scar Serum 30ml in Bangladesh. 100% authentic Korea import. Dhaka 1-2 days delivery. COD available at Emart Skincare Bangladesh.","Buy Palmers Cocoa &amp; Butter Formula Scar Serum 30ml in Bangladesh. 100% authentic USA-origin product. Dhaka 1-2 days delivery. COD available at Emart Skincare Bangladesh."
planned_update,37962,palmolive-for-men-classic-palm-extract-shave-cream-100ml,"Palmolive For Men Classic Palm Extract Shave Cream 100ml",USA,post_content,,origin_specific_safe_text,"Honestly, we‚Äôre pretty impressed with this product. Palmolive For Men Classic Palm Extract Shave Cream is a gem for anyone looking for a smooth, irritation-free shave. Designe...","Honestly, we‚Äôre pretty impressed with this product. Palmolive For Men Classic Palm Extract Shave Cream is a gem for anyone looking for a smooth, irritation-free shave. Designe..."
planned_update,37962,palmolive-for-men-classic-palm-extract-shave-cream-100ml,"Palmolive For Men Classic Palm Extract Shave Cream 100ml",USA,post_excerpt,,origin_specific_safe_text,"Buy Palmolive For Men Classic Palm Extract Shave Cream 100ml in Bangladesh. 100% authentic Korea import. Dhaka 1-2 days delivery. COD available at Emart Skincare Bangladesh.","Buy Palmolive For Men Classic Palm Extract Shave Cream 100ml in Bangladesh. 100% authentic USA-origin product. Dhaka 1-2 days delivery. COD available at Emart Skincare Bangladesh."
planned_update,37980,beauty-formulas-vitamin-e-hair-removal-wax-strips-for-legs-body-20pc,"Beauty Formulas Vitamin E Hair Removal Wax Strips For Legs & Body 20pc",USA,post_excerpt,,origin_specific_safe_text,"Buy Beauty Formulas Vitamin E Hair Removal Wax Strips For Legs &amp; Body 20pc in Bangladesh. 100% authentic Korea import. Dhaka 1-2 days delivery. COD available at Emart Skinca...","Buy Beauty Formulas Vitamin E Hair Removal Wax Strips For Legs &amp; Body 20pc in Bangladesh. 100% authentic USA-origin product. Dhaka 1-2 days delivery. COD available at Emart ..."
planned_update,37986,beauty-formulas-argan-oil-wax-strips-hair-remover-legs-body-20pc,"Beauty Formulas Argan OIl Wax Strips Hair Remover Legs & Body 20pc",UK,post_excerpt,,origin_specific_safe_text,"Buy Beauty Formulas Argan OIl Wax Strips Hair Remover Legs &amp; Body 20pc in Bangladesh. 100% authentic Korea import. Dhaka 1-2 days delivery. COD available at Emart Skincare B...","Buy Beauty Formulas Argan OIl Wax Strips Hair Remover Legs &amp; Body 20pc in Bangladesh. 100% authentic UK-origin product. Dhaka 1-2 days delivery. COD available at Emart Skinc..."
planned_update,37992,nair-hair-remover-body-20-wax-strips,"Nair Hair Remover Body 20 Wax Strips",USA,post_excerpt,,origin_specific_safe_text,"Buy Nair Hair Remover Body 20 Wax Strips in Bangladesh. 100% authentic Korea import. Dhaka 1-2 days delivery. COD available at Emart Skincare Bangladesh.","Buy Nair Hair Remover Body 20 Wax Strips in Bangladesh. 100% authentic USA-origin product. Dhaka 1-2 days delivery. COD available at Emart Skincare Bangladesh."
planned_update,38003,nair-facial-wax-strips-pack-of-12,"Nair Facial Wax Strips, Pack of 12",USA,post_excerpt,,origin_specific_safe_text,"Buy Nair Facial Wax Strips, Pack of 12 in Bangladesh. 100% authentic Korea import. Dhaka 1-2 days delivery. COD available at Emart Skincare Bangladesh.","Buy Nair Facial Wax Strips, Pack of 12 in Bangladesh. 100% authentic USA-origin product. Dhaka 1-2 days delivery. COD available at Emart Skincare Bangladesh."
planned_update,38009,bioderma-abcderm-cleansing-milk-500ml,"Bioderma ABCDerm Cleansing Milk 500ml",USA,post_excerpt,,origin_specific_safe_text,"Buy Bioderma ABCDerm Cleansing Milk 500ml in Bangladesh. 100% authentic Korea import. Dhaka 1-2 days delivery. COD available at Emart Skincare Bangladesh.","Buy Bioderma ABCDerm Cleansing Milk 500ml in Bangladesh. 100% authentic USA-origin product. Dhaka 1-2 days delivery. COD available at Emart Skincare Bangladesh."
planned_update,38062,palmers-cocoa-butter-formula-massage-cream-125ge,"Palmers Cocoa Butter Formula Massage Cream 125ge",USA,post_excerpt,,origin_specific_safe_text,"Buy Palmers Cocoa Butter Formula Massage Cream 125ge in Bangladesh. 100% authentic Korea import. Dhaka 1-2 days delivery. COD available at Emart Skincare Bangladesh.","Buy Palmers Cocoa Butter Formula Massage Cream 125ge in Bangladesh. 100% authentic USA-origin product. Dhaka 1-2 days delivery. COD available at Emart Skincare Bangladesh."
planned_update,38065,palmers-cocoa-butter-formula-with-vitamin-e-bust-cream-125ml,"Palmers Cocoa Butter Formula With Vitamin E Bust Cream 125ml",USA,post_excerpt,,origin_specific_safe_text,"Buy Palmers Cocoa Butter Formula With Vitamin E Bust Cream 125ml in Bangladesh. 100% authentic Korea import. Dhaka 1-2 days delivery. COD available at Emart Skincare Bangladesh.","Buy Palmers Cocoa Butter Formula With Vitamin E Bust Cream 125ml in Bangladesh. 100% authentic USA-origin product. Dhaka 1-2 days delivery. COD available at Emart Skincare Bangl..."
planned_update,38068,palmers-skin-success-medicated-complexion-bar-100ge,"Palmers Skin Success Medicated Complexion Bar 100ge",USA,post_excerpt,,origin_specific_safe_text,"Buy Palmers Skin Success Medicated Complexion Bar 100ge in Bangladesh. 100% authentic Korea import. Dhaka 1-2 days delivery. COD available at Emart Skincare Bangladesh.","Buy Palmers Skin Success Medicated Complexion Bar 100ge in Bangladesh. 100% authentic USA-origin product. Dhaka 1-2 days delivery. COD available at Emart Skincare Bangladesh."
planned_update,38103,ponds-super-light-gel-oil-free-moisturiser,"POND'S Super Light Gel Oil Free Face Moisturizer 100g",Multinational,post_excerpt,,multinational_generic_safe_text,"Buy POND'S Super Light Gel Oil Free Face Moisturizer 100g in Bangladesh. 100% authentic Korea import. Dhaka 1-2 days delivery. COD available at Emart Skincare Bangladesh.","Buy POND'S Super Light Gel Oil Free Face Moisturizer 100g in Bangladesh. 100% authentic Emart-verified product. Dhaka 1-2 days delivery. COD available at Emart Skincare Bangladesh."
planned_update,38109,ponds-super-light-gel-moisturiser,"Pond‚Äôs Super Light Gel Moisturiser",USA,post_excerpt,,origin_specific_safe_text,"Buy Pond‚Äôs Super Light Gel Moisturiser in Bangladesh. 100% authentic Korea import. Dhaka 1-2 days delivery. COD available at Emart Skincare Bangladesh.","Buy Pond‚Äôs Super Light Gel Moisturiser in Bangladesh. 100% authentic USA-origin product. Dhaka 1-2 days delivery. COD available at Emart Skincare Bangladesh."
planned_update,38145,skin-cafe-organic-extra-virgin-olive-oil,"Skin Cafe Organic Extra Virgin Olive Oil",Multinational,post_content,,multinational_generic_safe_text,"Thinking about the climate and skin concerns in Bangladesh, Skin Cafe Organic Extra Virgin Olive Oil has been introduced to meet your needs. Living in Dhaka means dealing with h...","Thinking about the climate and skin concerns in Bangladesh, Skin Cafe Organic Extra Virgin Olive Oil has been introduced to meet your needs. Living in Dhaka means dealing with h..."
planned_update,38145,skin-cafe-organic-extra-virgin-olive-oil,"Skin Cafe Organic Extra Virgin Olive Oil",Multinational,post_excerpt,,multinational_generic_safe_text,"Buy Skin Cafe Organic Extra Virgin Olive Oil in Bangladesh. 100% authentic Korea import. Dhaka 1-2 days delivery. COD available at Emart Skincare Bangladesh.","Buy Skin Cafe Organic Extra Virgin Olive Oil in Bangladesh. 100% authentic Emart-verified product. Dhaka 1-2 days delivery. COD available at Emart Skincare Bangladesh."
