action,post_id,slug,title,origin,field,meta_key,label_status,before_snippet,after_snippet
planned_update,63239,la-roche-posay-pure-vitamin-c-10-serum-30ml,"La Roche Posay Pure Vitamin C 10 Serum 30ml",France,post_excerpt,,origin_specific_safe_text,"Buy La Roche Posay Pure Vitamin C 10 Serum 30ml in Bangladesh. 100% authentic Korea import. Dhaka 1-2 days delivery. COD available at Emart Skincare Bangladesh.","Buy La Roche Posay Pure Vitamin C 10 Serum 30ml in Bangladesh. 100% authentic French product. Dhaka 1-2 days delivery. COD available at Emart Skincare Bangladesh."
planned_update,63241,la-roche-posay-retinol-b3-pure-retinol-serum-30ml,"La Roche Posay Retinol B3 Pure Retinol Serum 30ml",France,post_excerpt,,origin_specific_safe_text,"Buy La Roche Posay Retinol B3 Pure Retinol Serum 30ml in Bangladesh. 100% authentic Korea import. Dhaka 1-2 days delivery. COD available at Emart Skincare Bangladesh.","Buy La Roche Posay Retinol B3 Pure Retinol Serum 30ml in Bangladesh. 100% authentic French product. Dhaka 1-2 days delivery. COD available at Emart Skincare Bangladesh."
planned_update,63243,la-roche-posay-pure-niacinamide-10-serum-30ml,"La Roche-Posay Pure Niacinamide 10 Serum 30ml",France,post_excerpt,,origin_specific_safe_text,"Buy La Roche-Posay Pure Niacinamide 10 Serum 30ml in Bangladesh. 100% authentic Korea import. Dhaka 1-2 days delivery. COD available at Emart Skincare Bangladesh.","Buy La Roche-Posay Pure Niacinamide 10 Serum 30ml in Bangladesh. 100% authentic French product. Dhaka 1-2 days delivery. COD available at Emart Skincare Bangladesh."
planned_update,63247,la-roche-posay-cicaplast-baume-b5-spf50-40ml,"La Roche-Posay Cicaplast Baume B5 SPF50 40ml",France,post_excerpt,,origin_specific_safe_text,"Buy La Roche-Posay Cicaplast Baume B5 SPF50 40ml in Bangladesh. 100% authentic Korea import. Dhaka 1-2 days delivery. COD available at Emart Skincare Bangladesh.","Buy La Roche-Posay Cicaplast Baume B5 SPF50 40ml in Bangladesh. 100% authentic French product. Dhaka 1-2 days delivery. COD available at Emart Skincare Bangladesh."
planned_update,63423,cetaphil-oily-skin-cleanser-236ml,"Cetaphil Oily Skin Cleanser 236ml",USA,post_excerpt,,origin_specific_safe_text,"Buy Cetaphil Oily Skin Cleanser 236ml in Bangladesh. 100% authentic Korea import. Dhaka 1-2 days delivery. COD available at Emart Skincare Bangladesh.","Buy Cetaphil Oily Skin Cleanser 236ml in Bangladesh. 100% authentic USA-origin product. Dhaka 1-2 days delivery. COD available at Emart Skincare Bangladesh."
planned_update,63439,differin-gel-acne-treatment-45g,"Differin Gel Acne Treatment &#8211; 45g",USA,post_content,,origin_specific_safe_text,"Considering Bangladesh's weather and its impact on skin, Differin Gel Acne Treatment ‚Äì 45g has been introduced to help you combat acne effectively. Developed in Korea, this pr...","Considering Bangladesh's weather and its impact on skin, Differin Gel Acne Treatment ‚Äì 45g has been introduced to help you combat acne effectively. Developed in Korea, this pr..."
planned_update,63439,differin-gel-acne-treatment-45g,"Differin Gel Acne Treatment &#8211; 45g",USA,post_excerpt,,origin_specific_safe_text,"Buy Differin Gel Acne Treatment &#8211; 45g in Bangladesh. 100% authentic Korea import. Dhaka 1-2 days delivery. COD available at Emart Skincare Bangladesh.","Buy Differin Gel Acne Treatment &#8211; 45g in Bangladesh. 100% authentic USA-origin product. Dhaka 1-2 days delivery. COD available at Emart Skincare Bangladesh."
planned_update,63593,lubriderm-daily-moisture-lotion-for-normal-to-dry-skin-fragrance-free-177ml,"Lubriderm Daily Moisture Lotion for Normal to Dry Skin (Fragrance Free) 177ml",USA,post_excerpt,,origin_specific_safe_text,"Buy Lubriderm Daily Moisture Lotion for Normal to Dry Skin (Fragrance Free) 177ml in Bangladesh. 100% authentic Korea import. Dhaka 1-2 days delivery. COD available at Emart Ski...","Buy Lubriderm Daily Moisture Lotion for Normal to Dry Skin (Fragrance Free) 177ml in Bangladesh. 100% authentic USA-origin product. Dhaka 1-2 days delivery. COD available at Ema..."
planned_update,63595,lubriderm-daily-moisture-lotion-for-normal-to-dry-skin-sensitive-skin-473ml,"Lubriderm Daily Moisture Lotion for Normal to Dry Skin (Sensitive Skin) -473ml",USA,post_content,,origin_specific_safe_text,"Emart team has personally verified this product and ensured it meets the highest quality standards. Lubriderm Daily Moisture Lotion for Normal to Dry Skin (Sensitive Skin) -473m...","Emart team has personally verified this product and ensured it meets the highest quality standards. Lubriderm Daily Moisture Lotion for Normal to Dry Skin (Sensitive Skin) -473m..."
planned_update,63595,lubriderm-daily-moisture-lotion-for-normal-to-dry-skin-sensitive-skin-473ml,"Lubriderm Daily Moisture Lotion for Normal to Dry Skin (Sensitive Skin) -473ml",USA,post_excerpt,,origin_specific_safe_text,"Buy Lubriderm Daily Moisture Lotion for Normal to Dry Skin (Sensitive Skin) -473ml in Bangladesh. 100% authentic Korea import. Dhaka 1-2 days delivery. COD available at Emart Sk...","Buy Lubriderm Daily Moisture Lotion for Normal to Dry Skin (Sensitive Skin) -473ml in Bangladesh. 100% authentic USA-origin product. Dhaka 1-2 days delivery. COD available at Em..."
planned_update,63597,lubriderm-daily-moisture-lotion-for-normal-to-dry-skin-fragrance-free-473ml,"Lubriderm Daily Moisture Lotion for Normal to Dry Skin, Fragrance Free -473ml",USA,post_content,,origin_specific_safe_text,"‡¶Ü‡¶Æ‡¶æ‡¶¶‡ßá‡¶∞ ‡¶è‡¶ï‡¶ú‡¶® customer ‡¶™‡ßç‡¶∞‡¶•‡¶Æ ‡¶è‡¶á ‡¶™‡¶£‡ßç‡¶Ø‡¶ü‡¶æ‡¶∞ ‡¶ï‡¶•‡¶æ ‡¶¨‡¶≤‡ßá‡¶õ‡¶ø‡¶≤‡ßá‡¶®‡•§ After trying the Lubriderm Daily Moisture Lotion for ...","‡¶Ü‡¶Æ‡¶æ‡¶¶‡ßá‡¶∞ ‡¶è‡¶ï‡¶ú‡¶® customer ‡¶™‡ßç‡¶∞‡¶•‡¶Æ ‡¶è‡¶á ‡¶™‡¶£‡ßç‡¶Ø‡¶ü‡¶æ‡¶∞ ‡¶ï‡¶•‡¶æ ‡¶¨‡¶≤‡ßá‡¶õ‡¶ø‡¶≤‡ßá‡¶®‡•§ After trying the Lubriderm Daily Moisture Lotion for ..."
planned_update,63597,lubriderm-daily-moisture-lotion-for-normal-to-dry-skin-fragrance-free-473ml,"Lubriderm Daily Moisture Lotion for Normal to Dry Skin, Fragrance Free -473ml",USA,post_excerpt,,origin_specific_safe_text,"Buy Lubriderm Daily Moisture Lotion for Normal to Dry Skin, Fragrance Free -473ml in Bangladesh. 100% authentic Korea import. Dhaka 1-2 days delivery. COD available at Emart Ski...","Buy Lubriderm Daily Moisture Lotion for Normal to Dry Skin, Fragrance Free -473ml in Bangladesh. 100% authentic USA-origin product. Dhaka 1-2 days delivery. COD available at Ema..."
planned_update,63599,jamaican-black-castor-oil-coconut-118ml,"Jamaican Black Castor Oil (Coconut) 118ml",USA,post_excerpt,,origin_specific_safe_text,"Buy Jamaican Black Castor Oil (Coconut) 118ml in Bangladesh. 100% authentic Korea import. Dhaka 1-2 days delivery. COD available at Emart Skincare Bangladesh.","Buy Jamaican Black Castor Oil (Coconut) 118ml in Bangladesh. 100% authentic USA-origin product. Dhaka 1-2 days delivery. COD available at Emart Skincare Bangladesh."
planned_update,63601,la-roche-posay-effaclar-purifying-cleansing-gel-400ml,"La Roche Posay Effaclar Purifying Cleansing Gel 400ml",France,post_excerpt,,origin_specific_safe_text,"Buy La Roche Posay Effaclar Purifying Cleansing Gel 400ml in Bangladesh. 100% authentic Korea import. Dhaka 1-2 days delivery. COD available at Emart Skincare Bangladesh.","Buy La Roche Posay Effaclar Purifying Cleansing Gel 400ml in Bangladesh. 100% authentic French product. Dhaka 1-2 days delivery. COD available at Emart Skincare Bangladesh."
planned_update,63655,differin-gel-acne-treatment-15g,"Differin Gel Acne Treatment 15g",USA,post_excerpt,,origin_specific_safe_text,"Buy Differin Gel Acne Treatment 15g in Bangladesh. 100% authentic Korea import. Dhaka 1-2 days delivery. COD available at Emart Skincare Bangladesh.","Buy Differin Gel Acne Treatment 15g in Bangladesh. 100% authentic USA-origin product. Dhaka 1-2 days delivery. COD available at Emart Skincare Bangladesh."
planned_update,63787,la-roche-posay-effaclar-duo-anti-imperfections-for-oily-acne-prone-skin-40ml,"La Roche-Posay Effaclar Duo+ Anti-Imperfections For Oily & Acne Prone Skin 40ml",France,post_content,,origin_specific_safe_text,"The Emart team has personally tested La Roche-Posay Effaclar Duo+, and we can confidently say it‚Äôs a must-have for anyone with oily and acne-prone skin. Living in Dhaka, where...","The Emart team has personally tested La Roche-Posay Effaclar Duo+, and we can confidently say it‚Äôs a must-have for anyone with oily and acne-prone skin. Living in Dhaka, where..."
planned_update,63787,la-roche-posay-effaclar-duo-anti-imperfections-for-oily-acne-prone-skin-40ml,"La Roche-Posay Effaclar Duo+ Anti-Imperfections For Oily & Acne Prone Skin 40ml",France,post_excerpt,,origin_specific_safe_text,"Buy La Roche-Posay Effaclar Duo+ Anti-Imperfections For Oily &amp; Acne Prone Skin 40ml in Bangladesh. 100% authentic Korea import. Dhaka 1-2 days delivery. COD available at Ema...","Buy La Roche-Posay Effaclar Duo+ Anti-Imperfections For Oily &amp; Acne Prone Skin 40ml in Bangladesh. 100% authentic French product. Dhaka 1-2 days delivery. COD available at E..."
planned_update,63789,la-roche-posay-anthelios-ultra-light-fluid-facial-sunscreen-spf60-50ml,"LA Roche-Posay Anthelios Ultra Light Fluid Facial Sunscreen SPF60 50ml",France,post_excerpt,,origin_specific_safe_text,"Buy LA Roche-Posay Anthelios Ultra Light Fluid Facial Sunscreen SPF60 50ml in Bangladesh. 100% authentic Korea import. Dhaka 1-2 days delivery. COD available at Emart Skincare B...","Buy LA Roche-Posay Anthelios Ultra Light Fluid Facial Sunscreen SPF60 50ml in Bangladesh. 100% authentic French product. Dhaka 1-2 days delivery. COD available at Emart Skincare..."
planned_update,63791,la-roche-posay-toleriane-hydrating-gentle-cleanser-400-ml,"La Roche Posay Toleriane Hydrating Gentle Cleanser &#8211; 400 ml",France,post_content,,origin_specific_safe_text,"Honestly, we are quite impressed with this product. La Roche Posay Toleriane Hydrating Gentle Cleanser ‚Äì 400 ml is a for anyone dealing with Dhaka's humidity, pollution, and h...","Honestly, we are quite impressed with this product. La Roche Posay Toleriane Hydrating Gentle Cleanser ‚Äì 400 ml is a for anyone dealing with Dhaka's humidity, pollution, and h..."
planned_update,63791,la-roche-posay-toleriane-hydrating-gentle-cleanser-400-ml,"La Roche Posay Toleriane Hydrating Gentle Cleanser &#8211; 400 ml",France,post_excerpt,,origin_specific_safe_text,"Buy La Roche Posay Toleriane Hydrating Gentle Cleanser &#8211; 400 ml in Bangladesh. 100% authentic Korea import. Dhaka 1-2 days delivery. COD available at Emart Skincare Bangla...","Buy La Roche Posay Toleriane Hydrating Gentle Cleanser &#8211; 400 ml in Bangladesh. 100% authentic French product. Dhaka 1-2 days delivery. COD available at Emart Skincare Bang..."
planned_update,63793,la-roche-posay-toleriane-purifying-foaming-cleanser-400-ml,"La Roche Posay Toleriane Purifying Foaming Cleanser &#8211; 400 ml",France,post_excerpt,,origin_specific_safe_text,"Buy La Roche Posay Toleriane Purifying Foaming Cleanser &#8211; 400 ml in Bangladesh. 100% authentic Korea import. Dhaka 1-2 days delivery. COD available at Emart Skincare Bangl...","Buy La Roche Posay Toleriane Purifying Foaming Cleanser &#8211; 400 ml in Bangladesh. 100% authentic French product. Dhaka 1-2 days delivery. COD available at Emart Skincare Ban..."
planned_update,63855,panoxyl-acne-foaming-wash-benzoyl-peroxide-10-156-g,"Panoxyl Acne Foaming Wash Benzoyl Peroxide 10% -156 g",USA,post_excerpt,,origin_specific_safe_text,"Buy Panoxyl Acne Foaming Wash Benzoyl Peroxide 10% -156 g in Bangladesh. 100% authentic Korea import. Dhaka 1-2 days delivery. COD available at Emart Skincare Bangladesh.","Buy Panoxyl Acne Foaming Wash Benzoyl Peroxide 10% -156 g in Bangladesh. 100% authentic USA-origin product. Dhaka 1-2 days delivery. COD available at Emart Skincare Bangladesh."
planned_update,63865,the-inkey-list-bakucchoil-30ml,"The Inkey List Bakucchoil &#8211; 30ml",UK,post_excerpt,,origin_specific_safe_text,"Buy The Inkey List Bakucchoil &#8211; 30ml in Bangladesh. 100% authentic Korea import. Dhaka 1-2 days delivery. COD available at Emart Skincare Bangladesh.","Buy The Inkey List Bakucchoil &#8211; 30ml in Bangladesh. 100% authentic UK-origin product. Dhaka 1-2 days delivery. COD available at Emart Skincare Bangladesh."
planned_update,63867,the-inkey-list-brighten-i-eye-cream-15ml,"The Inkey List Brighten-i Eye Cream &#8211; 15ml",UK,post_excerpt,,origin_specific_safe_text,"Buy The Inkey List Brighten-i Eye Cream &#8211; 15ml in Bangladesh. 100% authentic Korea import. Dhaka 1-2 days delivery. COD available at Emart Skincare Bangladesh.","Buy The Inkey List Brighten-i Eye Cream &#8211; 15ml in Bangladesh. 100% authentic UK-origin product. Dhaka 1-2 days delivery. COD available at Emart Skincare Bangladesh."
planned_update,63869,the-inkey-list-beta-hydroxy-acid-30ml,"The Inkey List Beta Hydroxy Acid &#8211; 30ml",UK,post_excerpt,,origin_specific_safe_text,"Buy The Inkey List Beta Hydroxy Acid &#8211; 30ml in Bangladesh. 100% authentic Korea import. Dhaka 1-2 days delivery. COD available at Emart Skincare Bangladesh.","Buy The Inkey List Beta Hydroxy Acid &#8211; 30ml in Bangladesh. 100% authentic UK-origin product. Dhaka 1-2 days delivery. COD available at Emart Skincare Bangladesh."
planned_update,63871,the-inkey-list-multi-biotic-moisturizer-30ml,"The Inkey List Multi-Biotic Moisturizer &#8211; 30ml",UK,post_excerpt,,origin_specific_safe_text,"Buy The Inkey List Multi-Biotic Moisturizer &#8211; 30ml in Bangladesh. 100% authentic Korea import. Dhaka 1-2 days delivery. COD available at Emart Skincare Bangladesh.","Buy The Inkey List Multi-Biotic Moisturizer &#8211; 30ml in Bangladesh. 100% authentic UK-origin product. Dhaka 1-2 days delivery. COD available at Emart Skincare Bangladesh."
planned_update,63873,the-inkey-list-collagen-booster-30ml,"The Inkey List Collagen Booster &#8211; 30ml",UK,post_excerpt,,origin_specific_safe_text,"Buy The Inkey List Collagen Booster &#8211; 30ml in Bangladesh. 100% authentic Korea import. Dhaka 1-2 days delivery. COD available at Emart Skincare Bangladesh.","Buy The Inkey List Collagen Booster &#8211; 30ml in Bangladesh. 100% authentic UK-origin product. Dhaka 1-2 days delivery. COD available at Emart Skincare Bangladesh."
planned_update,63875,the-inkey-list-vitamin-c-30ml,"The Inkey List Vitamin C &#8211; 30ml",UK,post_excerpt,,origin_specific_safe_text,"Buy The Inkey List Vitamin C &#8211; 30ml in Bangladesh. 100% authentic Korea import. Dhaka 1-2 days delivery. COD available at Emart Skincare Bangladesh.","Buy The Inkey List Vitamin C &#8211; 30ml in Bangladesh. 100% authentic UK-origin product. Dhaka 1-2 days delivery. COD available at Emart Skincare Bangladesh."
planned_update,63877,the-inkey-list-glycolic-acid-toner-100-ml,"The Inkey List Glycolic Acid Toner &#8211; 100 ml",UK,post_excerpt,,origin_specific_safe_text,"Buy The Inkey List Glycolic Acid Toner &#8211; 100 ml in Bangladesh. 100% authentic Korea import. Dhaka 1-2 days delivery. COD available at Emart Skincare Bangladesh.","Buy The Inkey List Glycolic Acid Toner &#8211; 100 ml in Bangladesh. 100% authentic UK-origin product. Dhaka 1-2 days delivery. COD available at Emart Skincare Bangladesh."
planned_update,63879,the-inkey-list-15-vitamin-c-and-egf-30-ml,"The Inkey List 15% Vitamin C And EGF &#8211; 30 ml",UK,post_excerpt,,origin_specific_safe_text,"Buy The Inkey List 15% Vitamin C And EGF &#8211; 30 ml in Bangladesh. 100% authentic Korea import. Dhaka 1-2 days delivery. COD available at Emart Skincare Bangladesh.","Buy The Inkey List 15% Vitamin C And EGF &#8211; 30 ml in Bangladesh. 100% authentic UK-origin product. Dhaka 1-2 days delivery. COD available at Emart Skincare Bangladesh."
planned_update,63881,the-inkey-list-polyglutamic-acid-30-ml,"The Inkey List Polyglutamic Acid &#8211; 30 ml",UK,post_excerpt,,origin_specific_safe_text,"Buy The Inkey List Polyglutamic Acid &#8211; 30 ml in Bangladesh. 100% authentic Korea import. Dhaka 1-2 days delivery. COD available at Emart Skincare Bangladesh.","Buy The Inkey List Polyglutamic Acid &#8211; 30 ml in Bangladesh. 100% authentic UK-origin product. Dhaka 1-2 days delivery. COD available at Emart Skincare Bangladesh."
planned_update,63883,the-inkey-list-fulvic-acid-brightening-cleanser-150-ml,"The Inkey List Fulvic Acid Brightening Cleanser &#8211; 150 ml",UK,post_excerpt,,origin_specific_safe_text,"Buy The Inkey List Fulvic Acid Brightening Cleanser &#8211; 150 ml in Bangladesh. 100% authentic Korea import. Dhaka 1-2 days delivery. COD available at Emart Skincare Bangladesh.","Buy The Inkey List Fulvic Acid Brightening Cleanser &#8211; 150 ml in Bangladesh. 100% authentic UK-origin product. Dhaka 1-2 days delivery. COD available at Emart Skincare Bang..."
planned_update,63885,the-inkey-list-rosehip-oil-30-ml,"The Inkey List Rosehip Oil &#8211; 30 ml",UK,post_excerpt,,origin_specific_safe_text,"Buy The Inkey List Rosehip Oil &#8211; 30 ml in Bangladesh. 100% authentic Korea import. Dhaka 1-2 days delivery. COD available at Emart Skincare Bangladesh.","Buy The Inkey List Rosehip Oil &#8211; 30 ml in Bangladesh. 100% authentic UK-origin product. Dhaka 1-2 days delivery. COD available at Emart Skincare Bangladesh."
planned_update,63887,the-inkey-list-peptide-moisturizer-50-ml,"The Inkey List Peptide Moisturizer &#8211; 50 ml",UK,post_excerpt,,origin_specific_safe_text,"Buy The Inkey List Peptide Moisturizer &#8211; 50 ml in Bangladesh. 100% authentic Korea import. Dhaka 1-2 days delivery. COD available at Emart Skincare Bangladesh.","Buy The Inkey List Peptide Moisturizer &#8211; 50 ml in Bangladesh. 100% authentic UK-origin product. Dhaka 1-2 days delivery. COD available at Emart Skincare Bangladesh."
planned_update,63889,the-inkey-list-lactic-acid-30-ml,"The Inkey List Lactic Acid &#8211; 30 ml",UK,post_excerpt,,origin_specific_safe_text,"Buy The Inkey List Lactic Acid &#8211; 30 ml in Bangladesh. 100% authentic Korea import. Dhaka 1-2 days delivery. COD available at Emart Skincare Bangladesh.","Buy The Inkey List Lactic Acid &#8211; 30 ml in Bangladesh. 100% authentic UK-origin product. Dhaka 1-2 days delivery. COD available at Emart Skincare Bangladesh."
planned_update,63891,the-inkey-list-hyaluronic-acid-30-ml,"The Inkey List Hyaluronic Acid &#8211; 30 ml",UK,post_excerpt,,origin_specific_safe_text,"Buy The Inkey List Hyaluronic Acid &#8211; 30 ml in Bangladesh. 100% authentic Korea import. Dhaka 1-2 days delivery. COD available at Emart Skincare Bangladesh.","Buy The Inkey List Hyaluronic Acid &#8211; 30 ml in Bangladesh. 100% authentic UK-origin product. Dhaka 1-2 days delivery. COD available at Emart Skincare Bangladesh."
planned_update,63893,the-inkey-list-retinol-eye-cream-15-ml,"The Inkey List Retinol Eye Cream &#8211; 15 ml",UK,post_content,,origin_specific_safe_text,"Emart team ‡¶è‡¶á ‡¶™‡¶£‡ßç‡¶Ø‡¶ü‡¶æ personally test ‡¶ï‡¶∞‡ßá‡¶õ‡ßá! The Inkey List Retinol Eye Cream ‚Äì 15 ml ‡¶ü‡¶æ ‡¶¢‡¶æ‡¶ï‡¶æ‡¶∞ humidity ‡¶Ü‡¶∞ pollution ‡¶è ‡¶Ü‡¶™‡¶®‡¶...","Emart team ‡¶è‡¶á ‡¶™‡¶£‡ßç‡¶Ø‡¶ü‡¶æ personally test ‡¶ï‡¶∞‡ßá‡¶õ‡ßá! The Inkey List Retinol Eye Cream ‚Äì 15 ml ‡¶ü‡¶æ ‡¶¢‡¶æ‡¶ï‡¶æ‡¶∞ humidity ‡¶Ü‡¶∞ pollution ‡¶è ‡¶Ü‡¶™‡¶®‡¶..."
planned_update,63893,the-inkey-list-retinol-eye-cream-15-ml,"The Inkey List Retinol Eye Cream &#8211; 15 ml",UK,post_excerpt,,origin_specific_safe_text,"Buy The Inkey List Retinol Eye Cream &#8211; 15 ml in Bangladesh. 100% authentic Korea import. Dhaka 1-2 days delivery. COD available at Emart Skincare Bangladesh.","Buy The Inkey List Retinol Eye Cream &#8211; 15 ml in Bangladesh. 100% authentic UK-origin product. Dhaka 1-2 days delivery. COD available at Emart Skincare Bangladesh."
planned_update,63895,the-inkey-list-vitamin-b-c-and-e-moisturizer-50-ml,"The Inkey List Vitamin B, C And E Moisturizer &#8211; 50 ml",UK,post_excerpt,,origin_specific_safe_text,"Buy The Inkey List Vitamin B, C And E Moisturizer &#8211; 50 ml in Bangladesh. 100% authentic Korea import. Dhaka 1-2 days delivery. COD available at Emart Skincare Bangladesh.","Buy The Inkey List Vitamin B, C And E Moisturizer &#8211; 50 ml in Bangladesh. 100% authentic UK-origin product. Dhaka 1-2 days delivery. COD available at Emart Skincare Banglad..."
planned_update,63897,the-inkey-list-alpha-arbutin-30-ml,"The Inkey List Alpha Arbutin &#8211; 30 ml",UK,post_excerpt,,origin_specific_safe_text,"Buy The Inkey List Alpha Arbutin &#8211; 30 ml in Bangladesh. 100% authentic Korea import. Dhaka 1-2 days delivery. COD available at Emart Skincare Bangladesh.","Buy The Inkey List Alpha Arbutin &#8211; 30 ml in Bangladesh. 100% authentic UK-origin product. Dhaka 1-2 days delivery. COD available at Emart Skincare Bangladesh."
planned_update,63899,the-inkey-list-oat-cleansing-balm-150ml,"The Inkey List Oat Cleansing Balm &#8211; 150ml",UK,post_excerpt,,origin_specific_safe_text,"Buy The Inkey List Oat Cleansing Balm &#8211; 150ml in Bangladesh. 100% authentic Korea import. Dhaka 1-2 days delivery. COD available at Emart Skincare Bangladesh.","Buy The Inkey List Oat Cleansing Balm &#8211; 150ml in Bangladesh. 100% authentic UK-origin product. Dhaka 1-2 days delivery. COD available at Emart Skincare Bangladesh."
planned_update,63901,the-inkey-list-succinic-acid-acne-treatment-15-ml,"The Inkey List Succinic Acid Acne Treatment &#8211; 15 ml",UK,post_excerpt,,origin_specific_safe_text,"Buy The Inkey List Succinic Acid Acne Treatment &#8211; 15 ml in Bangladesh. 100% authentic Korea import. Dhaka 1-2 days delivery. COD available at Emart Skincare Bangladesh.","Buy The Inkey List Succinic Acid Acne Treatment &#8211; 15 ml in Bangladesh. 100% authentic UK-origin product. Dhaka 1-2 days delivery. COD available at Emart Skincare Bangladesh."
planned_update,63903,the-inkey-list-caffeine-eye-cream-15-ml,"The Inkey List Caffeine Eye Cream &#8211; 15 ml",UK,post_excerpt,,origin_specific_safe_text,"Buy The Inkey List Caffeine Eye Cream &#8211; 15 ml in Bangladesh. 100% authentic Korea import. Dhaka 1-2 days delivery. COD available at Emart Skincare Bangladesh.","Buy The Inkey List Caffeine Eye Cream &#8211; 15 ml in Bangladesh. 100% authentic UK-origin product. Dhaka 1-2 days delivery. COD available at Emart Skincare Bangladesh."
planned_update,63907,the-inkey-list-niacinamide-30ml,"The INKEY List Niacinamide &#8211; 30ml",UK,post_excerpt,,origin_specific_safe_text,"Buy The INKEY List Niacinamide &#8211; 30ml in Bangladesh. 100% authentic Korea import. Dhaka 1-2 days delivery. COD available at Emart Skincare Bangladesh.","Buy The INKEY List Niacinamide &#8211; 30ml in Bangladesh. 100% authentic UK-origin product. Dhaka 1-2 days delivery. COD available at Emart Skincare Bangladesh."
planned_update,63909,the-inkey-list-q10-serum-30ml,"The INKEY List Q10 Serum 30ml",UK,post_excerpt,,origin_specific_safe_text,"Buy The INKEY List Q10 Serum 30ml in Bangladesh. 100% authentic Korea import. Dhaka 1-2 days delivery. COD available at Emart Skincare Bangladesh.","Buy The INKEY List Q10 Serum 30ml in Bangladesh. 100% authentic UK-origin product. Dhaka 1-2 days delivery. COD available at Emart Skincare Bangladesh."
planned_update,63911,the-inkey-list-2-tranexamic-acid-treatment-serum-30-ml,"The INKEY List 2% Tranexamic Acid Treatment Serum &#8211; 30 ml",UK,post_content,,origin_specific_safe_text,"One of our customers first introduced us to this product, and we‚Äôre so glad they did! The INKEY List 2% Tranexamic Acid Treatment Serum is a skincare gem that‚Äôs perfect for ...","One of our customers first introduced us to this product, and we‚Äôre so glad they did! The INKEY List 2% Tranexamic Acid Treatment Serum is a skincare gem that‚Äôs perfect for ..."
planned_update,63911,the-inkey-list-2-tranexamic-acid-treatment-serum-30-ml,"The INKEY List 2% Tranexamic Acid Treatment Serum &#8211; 30 ml",UK,post_excerpt,,origin_specific_safe_text,"Buy The INKEY List 2% Tranexamic Acid Treatment Serum &#8211; 30 ml in Bangladesh. 100% authentic Korea import. Dhaka 1-2 days delivery. COD available at Emart Skincare Bangladesh.","Buy The INKEY List 2% Tranexamic Acid Treatment Serum &#8211; 30 ml in Bangladesh. 100% authentic UK-origin product. Dhaka 1-2 days delivery. COD available at Emart Skincare Ban..."
planned_update,63913,the-inkey-list-retinol-30-ml,"The INKEY List Retinol &#8211; 30 ml",UK,post_excerpt,,origin_specific_safe_text,"Buy The INKEY List Retinol &#8211; 30 ml in Bangladesh. 100% authentic Korea import. Dhaka 1-2 days delivery. COD available at Emart Skincare Bangladesh.","Buy The INKEY List Retinol &#8211; 30 ml in Bangladesh. 100% authentic UK-origin product. Dhaka 1-2 days delivery. COD available at Emart Skincare Bangladesh."
planned_update,63915,paulas-choice-weightless-advanced-repairing-toner-118-ml,"Paula&#8217;s Choice Weightless Advanced Repairing Toner &#8211; 118 ml",France,post_excerpt,,origin_specific_safe_text,"Buy Paula&#8217;s Choice Weightless Advanced Repairing Toner &#8211; 118 ml in Bangladesh. 100% authentic Korea import. Dhaka 1-2 days delivery. COD available at Emart Skincare ...","Buy Paula&#8217;s Choice Weightless Advanced Repairing Toner &#8211; 118 ml in Bangladesh. 100% authentic French product. Dhaka 1-2 days delivery. COD available at Emart Skincar..."
