action,post_id,slug,title,origin,field,meta_key,label_status,before_snippet,after_snippet
planned_update,74723,laikou-sleeping-face-mask-3g,"LAIKOU Sleeping Face Mask 3g",China,post_excerpt,,origin_specific_safe_text,"Buy LAIKOU Sleeping Face Mask 3g in Bangladesh. 100% authentic Korea import. Dhaka 1-2 days delivery. COD available at Emart Skincare Bangladesh.","Buy LAIKOU Sleeping Face Mask 3g in Bangladesh. 100% authentic China-origin product. Dhaka 1-2 days delivery. COD available at Emart Skincare Bangladesh."
planned_update,74725,laikou-matcha-mud-mask-5g,"LAIKOU Matcha Mud Mask 5g",China,post_excerpt,,origin_specific_safe_text,"Buy LAIKOU Matcha Mud Mask 5g in Bangladesh. 100% authentic Korea import. Dhaka 1-2 days delivery. COD available at Emart Skincare Bangladesh.","Buy LAIKOU Matcha Mud Mask 5g in Bangladesh. 100% authentic China-origin product. Dhaka 1-2 days delivery. COD available at Emart Skincare Bangladesh."
planned_update,74727,lakme-sun-expert-spf50-pa-super-matte-lotion-sunscreen-100ml,"Lakme Sun Expert SPF50 PA++ Super Matte Lotion Sunscreen 100ml",India,post_excerpt,,origin_specific_safe_text,"Buy Lakme Sun Expert SPF50 PA++ Super Matte Lotion Sunscreen 100ml in Bangladesh. 100% authentic Korea import. Dhaka 1-2 days delivery. COD available at Emart Skincare Bangladesh.","Buy Lakme Sun Expert SPF50 PA++ Super Matte Lotion Sunscreen 100ml in Bangladesh. 100% authentic Indian product. Dhaka 1-2 days delivery. COD available at Emart Skincare Banglad..."
planned_update,74729,lakme-sun-expert-ultra-matte-spf-40-pa-compact,"Lakme Sun Expert Ultra Matte SPF 40 PA+++ Compact",India,post_excerpt,,origin_specific_safe_text,"Buy Lakme Sun Expert Ultra Matte SPF 40 PA+++ Compact in Bangladesh. 100% authentic Korea import. Dhaka 1-2 days delivery. COD available at Emart Skincare Bangladesh.","Buy Lakme Sun Expert Ultra Matte SPF 40 PA+++ Compact in Bangladesh. 100% authentic Indian product. Dhaka 1-2 days delivery. COD available at Emart Skincare Bangladesh."
planned_update,74731,lavino-vitamin-c-face-wash-with-tangerine-extract,"Lavino Vitamin C Face Wash - with Tangerine Extract",Bangladesh,post_excerpt,,origin_specific_safe_text,"Buy Lavino Vitamin C Face Wash - with Tangerine Extract in Bangladesh. 100% authentic Korea import. Dhaka 1-2 days delivery. COD available at Emart Skincare Bangladesh.","Buy Lavino Vitamin C Face Wash - with Tangerine Extract in Bangladesh. 100% authentic Bangladeshi product. Dhaka 1-2 days delivery. COD available at Emart Skincare Bangladesh."
planned_update,74733,lavino-brightening-moisturizer-with-alpha-arbutin-vitamin-e-50ml,"Lavino Brightening Moisturizer with Alpha Arbutin & Vitamin E 50ml",Bangladesh,post_excerpt,,origin_specific_safe_text,"Buy Lavino Brightening Moisturizer with Alpha Arbutin &amp; Vitamin E 50ml in Bangladesh. 100% authentic Korea import. Dhaka 1-2 days delivery. COD available at Emart Skincare B...","Buy Lavino Brightening Moisturizer with Alpha Arbutin &amp; Vitamin E 50ml in Bangladesh. 100% authentic Bangladeshi product. Dhaka 1-2 days delivery. COD available at Emart Ski..."
planned_update,74735,lavino-neem-purifying-face-wash-with-0-5-salicylic-acid-100ml,"Lavino Neem Purifying Face Wash With 0.5% Salicylic Acid 100ml",Bangladesh,post_excerpt,,origin_specific_safe_text,"Buy Lavino Neem Purifying Face Wash With 0.5% Salicylic Acid 100ml in Bangladesh. 100% authentic Korea import. Dhaka 1-2 days delivery. COD available at Emart Skincare Bangladesh.","Buy Lavino Neem Purifying Face Wash With 0.5% Salicylic Acid 100ml in Bangladesh. 100% authentic Bangladeshi product. Dhaka 1-2 days delivery. COD available at Emart Skincare Ba..."
planned_update,74737,lavino-milk-brightening-face-wash-100ml,"Lavino Milk Brightening Face Wash 100ml",Bangladesh,post_excerpt,,origin_specific_safe_text,"Buy Lavino Milk Brightening Face Wash 100ml in Bangladesh. 100% authentic Korea import. Dhaka 1-2 days delivery. COD available at Emart Skincare Bangladesh.","Buy Lavino Milk Brightening Face Wash 100ml in Bangladesh. 100% authentic Bangladeshi product. Dhaka 1-2 days delivery. COD available at Emart Skincare Bangladesh."
planned_update,74739,laxzin-100-pure-cold-pressed-hexane-free-castor-oil-100ml,"Laxzin 100% Pure Cold Pressed & Hexane Free castor Oil 100ml",France,post_excerpt,,origin_specific_safe_text,"Buy Laxzin 100% Pure Cold Pressed &amp; Hexane Free castor Oil 100ml in Bangladesh. 100% authentic Korea import. Dhaka 1-2 days delivery. COD available at Emart Skincare Banglad...","Buy Laxzin 100% Pure Cold Pressed &amp; Hexane Free castor Oil 100ml in Bangladesh. 100% authentic French product. Dhaka 1-2 days delivery. COD available at Emart Skincare Bangl..."
planned_update,74741,laxzin-saffron-with-goat-milk-soap-100g,"Laxzin Saffron with Goat Milk Soap 100g",France,post_excerpt,,origin_specific_safe_text,"Buy Laxzin Saffron with Goat Milk Soap 100g in Bangladesh. 100% authentic Korea import. Dhaka 1-2 days delivery. COD available at Emart Skincare Bangladesh.","Buy Laxzin Saffron with Goat Milk Soap 100g in Bangladesh. 100% authentic French product. Dhaka 1-2 days delivery. COD available at Emart Skincare Bangladesh."
planned_update,74743,laxzin-multi-peptide-hair-serum-30ml,"Laxzin Multi-Peptide Hair Serum 30ml",France,post_excerpt,,origin_specific_safe_text,"Buy Laxzin Multi-Peptide Hair Serum 30ml in Bangladesh. 100% authentic Korea import. Dhaka 1-2 days delivery. COD available at Emart Skincare Bangladesh.","Buy Laxzin Multi-Peptide Hair Serum 30ml in Bangladesh. 100% authentic French product. Dhaka 1-2 days delivery. COD available at Emart Skincare Bangladesh."
planned_update,74745,laxzin-daily-facial-cleanser-150ml,"Laxzin Daily Facial Cleanser 150ml",France,post_excerpt,,origin_specific_safe_text,"Buy Laxzin Daily Facial Cleanser 150ml in Bangladesh. 100% authentic Korea import. Dhaka 1-2 days delivery. COD available at Emart Skincare Bangladesh.","Buy Laxzin Daily Facial Cleanser 150ml in Bangladesh. 100% authentic French product. Dhaka 1-2 days delivery. COD available at Emart Skincare Bangladesh."
planned_update,74747,laxzin-anti-hair-loss-shampoo-with-vitamin-e-biotin-400ml,"Laxzin Anti-Hair Loss Shampoo With Vitamin E & Biotin 400ml",France,post_excerpt,,origin_specific_safe_text,"Buy Laxzin Anti-Hair Loss Shampoo With Vitamin E &amp; Biotin 400ml in Bangladesh. 100% authentic Korea import. Dhaka 1-2 days delivery. COD available at Emart Skincare Bangladesh.","Buy Laxzin Anti-Hair Loss Shampoo With Vitamin E &amp; Biotin 400ml in Bangladesh. 100% authentic French product. Dhaka 1-2 days delivery. COD available at Emart Skincare Bangla..."
planned_update,74749,laxzin-acne-control-facial-cleanser-150ml,"Laxzin Acne Control Facial Cleanser 150ml",France,post_excerpt,,origin_specific_safe_text,"Buy Laxzin Acne Control Facial Cleanser 150ml in Bangladesh. 100% authentic Korea import. Dhaka 1-2 days delivery. COD available at Emart Skincare Bangladesh.","Buy Laxzin Acne Control Facial Cleanser 150ml in Bangladesh. 100% authentic French product. Dhaka 1-2 days delivery. COD available at Emart Skincare Bangladesh."
planned_update,74751,laxzin-deeply-nourishing-face-body-shower-gel-280ml,"Laxzin Deeply Nourishing Face & Body Shower Gel 280ml",France,post_excerpt,,origin_specific_safe_text,"Buy Laxzin Deeply Nourishing Face &amp; Body Shower Gel 280ml in Bangladesh. 100% authentic Korea import. Dhaka 1-2 days delivery. COD available at Emart Skincare Bangladesh.","Buy Laxzin Deeply Nourishing Face &amp; Body Shower Gel 280ml in Bangladesh. 100% authentic French product. Dhaka 1-2 days delivery. COD available at Emart Skincare Bangladesh."
planned_update,74753,lilac-daily-soft-moisturizing-body-lotion-200ml,"Lilac Daily Soft Moisturizing Body Lotion 200ml",Bangladesh,post_excerpt,,origin_specific_safe_text,"Buy Lilac Daily Soft Moisturizing Body Lotion 200ml in Bangladesh. 100% authentic Korea import. Dhaka 1-2 days delivery. COD available at Emart Skincare Bangladesh.","Buy Lilac Daily Soft Moisturizing Body Lotion 200ml in Bangladesh. 100% authentic Bangladeshi product. Dhaka 1-2 days delivery. COD available at Emart Skincare Bangladesh."
planned_update,74755,lilac-3x-spot-lightener-50g,"Lilac 3X Spot Lightener 50g",Bangladesh,post_excerpt,,origin_specific_safe_text,"Buy Lilac 3X Spot Lightener 50g in Bangladesh. 100% authentic Korea import. Dhaka 1-2 days delivery. COD available at Emart Skincare Bangladesh.","Buy Lilac 3X Spot Lightener 50g in Bangladesh. 100% authentic Bangladeshi product. Dhaka 1-2 days delivery. COD available at Emart Skincare Bangladesh."
planned_update,74757,lilac-advanced-brightening-face-wash-dry-and-sensitive-skin-120ml,"Lilac Advanced Brightening Face Wash Dry And Sensitive Skin 120ml",Bangladesh,post_excerpt,,origin_specific_safe_text,"Buy Lilac Advanced Brightening Face Wash Dry And Sensitive Skin 120ml in Bangladesh. 100% authentic Korea import. Dhaka 1-2 days delivery. COD available at Emart Skincare Bangla...","Buy Lilac Advanced Brightening Face Wash Dry And Sensitive Skin 120ml in Bangladesh. 100% authentic Bangladeshi product. Dhaka 1-2 days delivery. COD available at Emart Skincare..."
planned_update,74759,lilac-brightening-face-wash-oily-combination-skin-120ml,"Lilac Brightening Face Wash Oily & Combination Skin 120ml",Bangladesh,post_excerpt,,origin_specific_safe_text,"Buy Lilac Brightening Face Wash Oily &amp; Combination Skin 120ml in Bangladesh. 100% authentic Korea import. Dhaka 1-2 days delivery. COD available at Emart Skincare Bangladesh.","Buy Lilac Brightening Face Wash Oily &amp; Combination Skin 120ml in Bangladesh. 100% authentic Bangladeshi product. Dhaka 1-2 days delivery. COD available at Emart Skincare Ban..."
planned_update,74763,maange-12pcs-mix-makeup-brush-set-white,"Maange 12pcs Mix Makeup Brush Set White",China,post_excerpt,,origin_specific_safe_text,"Buy Maange 12pcs Mix Makeup Brush Set White in Bangladesh. 100% authentic Korea import. Dhaka 1-2 days delivery. COD available at Emart Skincare Bangladesh.","Buy Maange 12pcs Mix Makeup Brush Set White in Bangladesh. 100% authentic China-origin product. Dhaka 1-2 days delivery. COD available at Emart Skincare Bangladesh."
planned_update,74766,maange-12pcs-mix-makeup-brush-set-pink,"Maange 12pcs Mix Makeup Brush Set Pink",China,post_excerpt,,origin_specific_safe_text,"Buy Maange 12pcs Mix Makeup Brush Set Pink in Bangladesh. 100% authentic Korea import. Dhaka 1-2 days delivery. COD available at Emart Skincare Bangladesh.","Buy Maange 12pcs Mix Makeup Brush Set Pink in Bangladesh. 100% authentic China-origin product. Dhaka 1-2 days delivery. COD available at Emart Skincare Bangladesh."
planned_update,74768,maange-10pcs-brush-set-with-bag-pink,"Maange 10pcs Brush Set With Bag (Pink)",China,post_excerpt,,origin_specific_safe_text,"Buy Maange 10pcs Brush Set With Bag (Pink) in Bangladesh. 100% authentic Korea import. Dhaka 1-2 days delivery. COD available at Emart Skincare Bangladesh.","Buy Maange 10pcs Brush Set With Bag (Pink) in Bangladesh. 100% authentic China-origin product. Dhaka 1-2 days delivery. COD available at Emart Skincare Bangladesh."
planned_update,74770,maange-makeup-clean-sponge,"Maange Makeup Clean Sponge",China,post_excerpt,,origin_specific_safe_text,"Buy Maange Makeup Clean Sponge in Bangladesh. 100% authentic Korea import. Dhaka 1-2 days delivery. COD available at Emart Skincare Bangladesh.","Buy Maange Makeup Clean Sponge in Bangladesh. 100% authentic China-origin product. Dhaka 1-2 days delivery. COD available at Emart Skincare Bangladesh."
planned_update,74772,magefy-7-pairs-false-eyelashes,"MAGEFY 7 Pairs False Eyelashes",Turkey,post_excerpt,,origin_specific_safe_text,"Buy MAGEFY 7 Pairs False Eyelashes in Bangladesh. 100% authentic Korea import. Dhaka 1-2 days delivery. COD available at Emart Skincare Bangladesh.","Buy MAGEFY 7 Pairs False Eyelashes in Bangladesh. 100% authentic Turkish product. Dhaka 1-2 days delivery. COD available at Emart Skincare Bangladesh."
planned_update,74822,matrix-opti-care-smooth-straight-split-end-serum-100ml,"Matrix Opti Care Smooth Straight Split End Serum 100ml",UK,post_excerpt,,origin_specific_safe_text,"Buy Matrix Opti Care Smooth Straight Split End Serum 100ml in Bangladesh. 100% authentic Korea import. Dhaka 1-2 days delivery. COD available at Emart Skincare Bangladesh.","Buy Matrix Opti Care Smooth Straight Split End Serum 100ml in Bangladesh. 100% authentic UK-origin product. Dhaka 1-2 days delivery. COD available at Emart Skincare Bangladesh."
planned_update,74824,matrix-mega-smooth-professional-mask-500ml,"Matrix Mega Smooth Professional Mask 500ml",UK,post_excerpt,,origin_specific_safe_text,"Buy Matrix Mega Smooth Professional Mask 500ml in Bangladesh. 100% authentic Korea import. Dhaka 1-2 days delivery. COD available at Emart Skincare Bangladesh.","Buy Matrix Mega Smooth Professional Mask 500ml in Bangladesh. 100% authentic UK-origin product. Dhaka 1-2 days delivery. COD available at Emart Skincare Bangladesh."
planned_update,74826,matrix-opti-care-smooth-straight-professional-conditioner-98g,"Matrix Opti Care Smooth Straight Professional Conditioner 98g",UK,post_excerpt,,origin_specific_safe_text,"Buy Matrix Opti Care Smooth Straight Professional Conditioner 98g in Bangladesh. 100% authentic Korea import. Dhaka 1-2 days delivery. COD available at Emart Skincare Bangladesh.","Buy Matrix Opti Care Smooth Straight Professional Conditioner 98g in Bangladesh. 100% authentic UK-origin product. Dhaka 1-2 days delivery. COD available at Emart Skincare Bangl..."
planned_update,74828,matrix-opticare-shampoo-200ml,"Matrix Opticare Shampoo 200ml",UK,post_excerpt,,origin_specific_safe_text,"Buy Matrix Opticare Shampoo 200ml in Bangladesh. 100% authentic Korea import. Dhaka 1-2 days delivery. COD available at Emart Skincare Bangladesh.","Buy Matrix Opticare Shampoo 200ml in Bangladesh. 100% authentic UK-origin product. Dhaka 1-2 days delivery. COD available at Emart Skincare Bangladesh."
planned_update,74830,maybelline-super-stay-matte-ink-liquid-lipstick-335-hustler-5ml,"Maybelline Super Stay Matte Ink Liquid Lipstick( 335 Hustler)-5ml",USA,post_excerpt,,origin_specific_safe_text,"Buy Maybelline Super Stay Matte Ink Liquid Lipstick( 335 Hustler)-5ml in Bangladesh. 100% authentic Korea import. Dhaka 1-2 days delivery. COD available at Emart Skincare Bangla...","Buy Maybelline Super Stay Matte Ink Liquid Lipstick( 335 Hustler)-5ml in Bangladesh. 100% authentic USA-origin product. Dhaka 1-2 days delivery. COD available at Emart Skincare ..."
planned_update,74832,maybelline-super-stay-matte-ink-liquid-lipstick-117-ground-breaker-5ml,"Maybelline Super Stay Matte Ink Liquid Lipstick (117 Ground Breaker) 5ml",USA,post_excerpt,,origin_specific_safe_text,"Buy Maybelline Super Stay Matte Ink Liquid Lipstick (117 Ground Breaker) 5ml in Bangladesh. 100% authentic Korea import. Dhaka 1-2 days delivery. COD available at Emart Skincare...","Buy Maybelline Super Stay Matte Ink Liquid Lipstick (117 Ground Breaker) 5ml in Bangladesh. 100% authentic USA-origin product. Dhaka 1-2 days delivery. COD available at Emart Sk..."
planned_update,74835,maybelline-super-stay-matte-ink-liquid-lipstick-340-exhilarator-5ml,"Maybelline Super Stay Matte Ink Liquid Lipstick( 340 exhilarator)-5ml",USA,post_excerpt,,origin_specific_safe_text,"Buy Maybelline Super Stay Matte Ink Liquid Lipstick( 340 exhilarator)-5ml in Bangladesh. 100% authentic Korea import. Dhaka 1-2 days delivery. COD available at Emart Skincare Ba...","Buy Maybelline Super Stay Matte Ink Liquid Lipstick( 340 exhilarator)-5ml in Bangladesh. 100% authentic USA-origin product. Dhaka 1-2 days delivery. COD available at Emart Skinc..."
planned_update,74837,maybelline-super-stay-matte-ink-liquid-lipstick15-lover-5ml,"Maybelline Super Stay Matte Ink Liquid Lipstick(15 Lover)-5ml",USA,post_excerpt,,origin_specific_safe_text,"Buy Maybelline Super Stay Matte Ink Liquid Lipstick(15 Lover)-5ml in Bangladesh. 100% authentic Korea import. Dhaka 1-2 days delivery. COD available at Emart Skincare Bangladesh.","Buy Maybelline Super Stay Matte Ink Liquid Lipstick(15 Lover)-5ml in Bangladesh. 100% authentic USA-origin product. Dhaka 1-2 days delivery. COD available at Emart Skincare Bang..."
planned_update,74839,maybelline-super-stay-vinyl-ink-long-wear-liquid-lipstick-80-eccentric-4-2ml,"Maybelline Super Stay Vinyl Ink Long-Wear Liquid Lipstick (80 ECCENTRIC) 4.2ml",USA,post_excerpt,,origin_specific_safe_text,"Buy Maybelline Super Stay Vinyl Ink Long-Wear Liquid Lipstick (80 ECCENTRIC) 4.2ml in Bangladesh. 100% authentic Korea import. Dhaka 1-2 days delivery. COD available at Emart Sk...","Buy Maybelline Super Stay Vinyl Ink Long-Wear Liquid Lipstick (80 ECCENTRIC) 4.2ml in Bangladesh. 100% authentic USA-origin product. Dhaka 1-2 days delivery. COD available at Em..."
planned_update,74841,maybelline-super-stay-vinyl-ink-long-wear-liquid-lipstick-160-sultry-4-2ml,"Maybelline Super Stay Vinyl Ink Long-Wear Liquid Lipstick (160- SULTRY) 4.2ml",USA,post_excerpt,,origin_specific_safe_text,"Buy Maybelline Super Stay Vinyl Ink Long-Wear Liquid Lipstick (160- SULTRY) 4.2ml in Bangladesh. 100% authentic Korea import. Dhaka 1-2 days delivery. COD available at Emart Ski...","Buy Maybelline Super Stay Vinyl Ink Long-Wear Liquid Lipstick (160- SULTRY) 4.2ml in Bangladesh. 100% authentic USA-origin product. Dhaka 1-2 days delivery. COD available at Ema..."
planned_update,74843,maybelline-super-stay-vinyl-ink-long-wear-liquid-lipstick-68-hypnotic-4-2-ml,"Maybelline Super Stay Vinyl Ink Long-Wear Liquid Lipstick (68-HYPNOTIC) 4.2 ml",USA,post_excerpt,,origin_specific_safe_text,"Buy Maybelline Super Stay Vinyl Ink Long-Wear Liquid Lipstick (68-HYPNOTIC) 4.2 ml in Bangladesh. 100% authentic Korea import. Dhaka 1-2 days delivery. COD available at Emart Sk...","Buy Maybelline Super Stay Vinyl Ink Long-Wear Liquid Lipstick (68-HYPNOTIC) 4.2 ml in Bangladesh. 100% authentic USA-origin product. Dhaka 1-2 days delivery. COD available at Em..."
planned_update,74845,maybelline-super-stay-vinyl-ink-long-wear-liquid-lipstick-15-peachy-4-2-ml,"Maybelline Super Stay Vinyl Ink Long-Wear Liquid Lipstick (15-PEACHY)  4.2 ml",USA,post_excerpt,,origin_specific_safe_text,"Buy Maybelline Super Stay Vinyl Ink Long-Wear Liquid Lipstick (15-PEACHY) 4.2 ml in Bangladesh. 100% authentic Korea import. Dhaka 1-2 days delivery. COD available at Emart Skin...","Buy Maybelline Super Stay Vinyl Ink Long-Wear Liquid Lipstick (15-PEACHY) 4.2 ml in Bangladesh. 100% authentic USA-origin product. Dhaka 1-2 days delivery. COD available at Emar..."
planned_update,74847,maybelline-super-stay-vinyl-ink-long-wear-liquid-lipstick-115-peppy,"Maybelline Super Stay Vinyl Ink Long-Wear Liquid Lipstick (115-Peppy)",USA,post_excerpt,,origin_specific_safe_text,"Buy Maybelline Super Stay Vinyl Ink Long-Wear Liquid Lipstick (115-Peppy) in Bangladesh. 100% authentic Korea import. Dhaka 1-2 days delivery. COD available at Emart Skincare Ba...","Buy Maybelline Super Stay Vinyl Ink Long-Wear Liquid Lipstick (115-Peppy) in Bangladesh. 100% authentic USA-origin product. Dhaka 1-2 days delivery. COD available at Emart Skinc..."
planned_update,74849,maybelline-baby-lips-color-lip-balm-berry-crush-spf20,"Maybelline Baby Lips Color Lip Balm Berry Crush SPF20",USA,post_excerpt,,origin_specific_safe_text,"Buy Maybelline Baby Lips Color Lip Balm Berry Crush SPF20 in Bangladesh. 100% authentic Korea import. Dhaka 1-2 days delivery. COD available at Emart Skincare Bangladesh.","Buy Maybelline Baby Lips Color Lip Balm Berry Crush SPF20 in Bangladesh. 100% authentic USA-origin product. Dhaka 1-2 days delivery. COD available at Emart Skincare Bangladesh."
planned_update,74851,maybelline-baby-lips-color-lip-balm-pink-lolita-spf20,"Maybelline Baby Lips Color Lip Balm Pink Lolita SPF20",USA,post_excerpt,,origin_specific_safe_text,"Buy Maybelline Baby Lips Color Lip Balm Pink Lolita SPF20 in Bangladesh. 100% authentic Korea import. Dhaka 1-2 days delivery. COD available at Emart Skincare Bangladesh.","Buy Maybelline Baby Lips Color Lip Balm Pink Lolita SPF20 in Bangladesh. 100% authentic USA-origin product. Dhaka 1-2 days delivery. COD available at Emart Skincare Bangladesh."
planned_update,74853,maybelline-baby-lips-color-lip-balm-cherry-kiss-spf20,"Maybelline Baby Lips Color Lip Balm Cherry Kiss SPF20",USA,post_excerpt,,origin_specific_safe_text,"Buy Maybelline Baby Lips Color Lip Balm Cherry Kiss SPF20 in Bangladesh. 100% authentic Korea import. Dhaka 1-2 days delivery. COD available at Emart Skincare Bangladesh.","Buy Maybelline Baby Lips Color Lip Balm Cherry Kiss SPF20 in Bangladesh. 100% authentic USA-origin product. Dhaka 1-2 days delivery. COD available at Emart Skincare Bangladesh."
planned_update,74889,miss-mrs-ultra-fine-waterproof-blue-dipliner-eye-liner-4-5ml,"Miss & Mrs Ultra Fine Waterproof Blue Dipliner Eye Liner 4.5ml",Germany,post_excerpt,,origin_specific_safe_text,"Buy Miss &amp; Mrs Ultra Fine Waterproof Blue Dipliner Eye Liner 4.5ml in Bangladesh. 100% authentic Korea import. Dhaka 1-2 days delivery. COD available at Emart Skincare Bangl...","Buy Miss &amp; Mrs Ultra Fine Waterproof Blue Dipliner Eye Liner 4.5ml in Bangladesh. 100% authentic German product. Dhaka 1-2 days delivery. COD available at Emart Skincare Ban..."
planned_update,74891,mistine-goat-milk-facial-foam-85g,"Mistine Goat Milk Facial Foam 85g",Thailand,post_excerpt,,origin_specific_safe_text,"Buy Mistine Goat Milk Facial Foam 85g in Bangladesh. 100% authentic Korea import. Dhaka 1-2 days delivery. COD available at Emart Skincare Bangladesh.","Buy Mistine Goat Milk Facial Foam 85g in Bangladesh. 100% authentic Thai product. Dhaka 1-2 days delivery. COD available at Emart Skincare Bangladesh."
planned_update,74893,miyako-hair-straightener-hs-916,"Miyako Hair Straightener HS-916",China,post_excerpt,,origin_specific_safe_text,"Buy Miyako Hair Straightener HS-916 in Bangladesh. 100% authentic Korea import. Dhaka 1-2 days delivery. COD available at Emart Skincare Bangladesh.","Buy Miyako Hair Straightener HS-916 in Bangladesh. 100% authentic China-origin product. Dhaka 1-2 days delivery. COD available at Emart Skincare Bangladesh."
planned_update,74895,muji-sensitive-skin-moisturising-cream-50g,"MUJI Sensitive Skin Moisturising Cream 50g",Japan,post_excerpt,,origin_specific_safe_text,"Buy MUJI Sensitive Skin Moisturising Cream 50g in Bangladesh. 100% authentic Korea import. Dhaka 1-2 days delivery. COD available at Emart Skincare Bangladesh.","Buy MUJI Sensitive Skin Moisturising Cream 50g in Bangladesh. 100% authentic Japanese product. Dhaka 1-2 days delivery. COD available at Emart Skincare Bangladesh."
planned_update,74897,muuchstac-ocean-facewash-for-man-100ml,"Muuchstac Ocean Facewash For Man 100ml",India,post_excerpt,,origin_specific_safe_text,"Buy Muuchstac Ocean Facewash For Man 100ml in Bangladesh. 100% authentic Korea import. Dhaka 1-2 days delivery. COD available at Emart Skincare Bangladesh.","Buy Muuchstac Ocean Facewash For Man 100ml in Bangladesh. 100% authentic Indian product. Dhaka 1-2 days delivery. COD available at Emart Skincare Bangladesh."
planned_update,74899,nature-beauty-neem-face-wash-100ml,"Nature Beauty Neem Face wash 100ml",Bangladesh,post_excerpt,,origin_specific_safe_text,"Buy Nature Beauty Neem Face wash 100ml in Bangladesh. 100% authentic Korea import. Dhaka 1-2 days delivery. COD available at Emart Skincare Bangladesh.","Buy Nature Beauty Neem Face wash 100ml in Bangladesh. 100% authentic Bangladeshi product. Dhaka 1-2 days delivery. COD available at Emart Skincare Bangladesh."
planned_update,74901,nature-beauty-healthy-glowing-moisturizing-body-lotion-370ml,"Nature Beauty Healthy Glowing Moisturizing Body Lotion 370ml",Bangladesh,post_excerpt,,origin_specific_safe_text,"Buy Nature Beauty Healthy Glowing Moisturizing Body Lotion 370ml in Bangladesh. 100% authentic Korea import. Dhaka 1-2 days delivery. COD available at Emart Skincare Bangladesh.","Buy Nature Beauty Healthy Glowing Moisturizing Body Lotion 370ml in Bangladesh. 100% authentic Bangladeshi product. Dhaka 1-2 days delivery. COD available at Emart Skincare Bang..."
planned_update,74903,nature-beauty-milk-soothing-gel-130ml,"Nature Beauty Milk Soothing Gel 130ml",Bangladesh,post_excerpt,,origin_specific_safe_text,"Buy Nature Beauty Milk Soothing Gel 130ml in Bangladesh. 100% authentic Korea import. Dhaka 1-2 days delivery. COD available at Emart Skincare Bangladesh.","Buy Nature Beauty Milk Soothing Gel 130ml in Bangladesh. 100% authentic Bangladeshi product. Dhaka 1-2 days delivery. COD available at Emart Skincare Bangladesh."
planned_update,74905,nature-beauty-milk-face-wash-100ml,"Nature Beauty Milk Face wash 100ml",Bangladesh,post_excerpt,,origin_specific_safe_text,"Buy Nature Beauty Milk Face wash 100ml in Bangladesh. 100% authentic Korea import. Dhaka 1-2 days delivery. COD available at Emart Skincare Bangladesh.","Buy Nature Beauty Milk Face wash 100ml in Bangladesh. 100% authentic Bangladeshi product. Dhaka 1-2 days delivery. COD available at Emart Skincare Bangladesh."
planned_update,74907,nature-beauty-salicylic-acid-2-face-serum-30ml,"Nature Beauty Salicylic Acid 2% Face Serum 30ml",Bangladesh,post_excerpt,,origin_specific_safe_text,"Buy Nature Beauty Salicylic Acid 2% Face Serum 30ml in Bangladesh. 100% authentic Korea import. Dhaka 1-2 days delivery. COD available at Emart Skincare Bangladesh.","Buy Nature Beauty Salicylic Acid 2% Face Serum 30ml in Bangladesh. 100% authentic Bangladeshi product. Dhaka 1-2 days delivery. COD available at Emart Skincare Bangladesh."
