action,post_id,slug,title,origin,field,meta_key,label_status,before_snippet,after_snippet
planned_update,26259,the-body-shop-himalayan-charcoal-purifying-glow-mask-75ml,"The Body Shop Himalayan Charcoal Purifying Glow Mask 75ml",UK,post_content,,origin_specific_safe_text,"Emart Skincare Bangladesh-‡¶§‡ßá ‡¶è‡¶á ‡¶™‡¶£‡ßç‡¶Ø‡¶ü‡¶æ ‡¶Ü‡¶®‡¶æ‡¶∞ ‡¶™‡ßá‡¶õ‡¶®‡ßá ‡¶è‡¶ï‡¶ü‡¶æ ‡¶ó‡¶≤‡ßç‡¶™ ‡¶Ü‡¶õ‡ßá‡•§ Dhaka‚Äôs heat, humidity, and pollution can take a...","Emart Skincare Bangladesh-‡¶§‡ßá ‡¶è‡¶á ‡¶™‡¶£‡ßç‡¶Ø‡¶ü‡¶æ ‡¶Ü‡¶®‡¶æ‡¶∞ ‡¶™‡ßá‡¶õ‡¶®‡ßá ‡¶è‡¶ï‡¶ü‡¶æ ‡¶ó‡¶≤‡ßç‡¶™ ‡¶Ü‡¶õ‡ßá‡•§ Dhaka‚Äôs heat, humidity, and pollution can take a..."
planned_update,26259,the-body-shop-himalayan-charcoal-purifying-glow-mask-75ml,"The Body Shop Himalayan Charcoal Purifying Glow Mask 75ml",UK,post_excerpt,,origin_specific_safe_text,"Buy The Body Shop Himalayan Charcoal Purifying Glow Mask 75ml in Bangladesh. 100% authentic Korea import. Dhaka 1-2 days delivery. COD available at Emart Skincare Bangladesh.","Buy The Body Shop Himalayan Charcoal Purifying Glow Mask 75ml in Bangladesh. 100% authentic UK-origin product. Dhaka 1-2 days delivery. COD available at Emart Skincare Bangladesh."
planned_update,26267,the-body-shop-vitamin-e-night-nourishing-cream-50ml,"The Body Shop Vitamin E Night Nourishing Cream 50ml",UK,post_excerpt,,origin_specific_safe_text,"Buy The Body Shop Vitamin E Night Nourishing Cream 50ml in Bangladesh. 100% authentic Korea import. Dhaka 1-2 days delivery. COD available at Emart Skincare Bangladesh.","Buy The Body Shop Vitamin E Night Nourishing Cream 50ml in Bangladesh. 100% authentic UK-origin product. Dhaka 1-2 days delivery. COD available at Emart Skincare Bangladesh."
planned_update,26353,simple-kind-to-skin-moisturising-facial-wash-150ml,"Simple Kind To Skin Moisturising Facial Wash 150ml",UK,post_excerpt,,origin_specific_safe_text,"Buy Simple Kind To Skin Moisturising Facial Wash 150ml in Bangladesh. 100% authentic Korea import. Dhaka 1-2 days delivery. COD available at Emart Skincare Bangladesh.","Buy Simple Kind To Skin Moisturising Facial Wash 150ml in Bangladesh. 100% authentic UK-origin product. Dhaka 1-2 days delivery. COD available at Emart Skincare Bangladesh."
planned_update,26359,simple-kind-to-skin-hydrating-light-moisturiser-125gm,"Simple Kind to Skin Hydrating Light Moisturiser 125gm",UK,post_excerpt,,origin_specific_safe_text,"Buy Simple Kind to Skin Hydrating Light Moisturiser 125gm in Bangladesh. 100% authentic Korea import. Dhaka 1-2 days delivery. COD available at Emart Skincare Bangladesh.","Buy Simple Kind to Skin Hydrating Light Moisturiser 125gm in Bangladesh. 100% authentic UK-origin product. Dhaka 1-2 days delivery. COD available at Emart Skincare Bangladesh."
planned_update,26362,simple-kind-to-skin-soothing-facial-toner-200ml,"Simple Kind To Skin Soothing Facial Toner 200ml",UK,post_excerpt,,origin_specific_safe_text,"Buy Simple Kind To Skin Soothing Facial Toner 200ml in Bangladesh. 100% authentic Korea import. Dhaka 1-2 days delivery. COD available at Emart Skincare Bangladesh.","Buy Simple Kind To Skin Soothing Facial Toner 200ml in Bangladesh. 100% authentic UK-origin product. Dhaka 1-2 days delivery. COD available at Emart Skincare Bangladesh."
planned_update,26366,simple-micellar-gel-wash-150ml,"Simple Purifying Gel Wash (150ml)",UK,post_excerpt,,origin_specific_safe_text,"Buy Simple Purifying Gel Wash (150ml) in Bangladesh. 100% authentic Korea import. Dhaka 1-2 days delivery. COD available at Emart Skincare Bangladesh.","Buy Simple Purifying Gel Wash (150ml) in Bangladesh. 100% authentic UK-origin product. Dhaka 1-2 days delivery. COD available at Emart Skincare Bangladesh."
planned_update,26368,simple-daily-detox-purifying-face-wash-150ml,"Simple Daily Detox Purifying Face Wash 150ml",UK,post_excerpt,,origin_specific_safe_text,"Buy Simple Daily Detox Purifying Face Wash 150ml in Bangladesh. 100% authentic Korea import. Dhaka 1-2 days delivery. COD available at Emart Skincare Bangladesh.","Buy Simple Daily Detox Purifying Face Wash 150ml in Bangladesh. 100% authentic UK-origin product. Dhaka 1-2 days delivery. COD available at Emart Skincare Bangladesh."
planned_update,26371,simple-regeneration-facial-wash-age-resisting-150ml,"Simple Regeneration Facial Wash Age Resisting 150ml",UK,post_excerpt,,origin_specific_safe_text,"Buy Simple Regeneration Facial Wash Age Resisting 150ml in Bangladesh. 100% authentic Korea import. Dhaka 1-2 days delivery. COD available at Emart Skincare Bangladesh.","Buy Simple Regeneration Facial Wash Age Resisting 150ml in Bangladesh. 100% authentic UK-origin product. Dhaka 1-2 days delivery. COD available at Emart Skincare Bangladesh."
planned_update,26435,simple-kind-to-skin-replenishing-rich-moisturizer-125gm,"Simple Kind to Skin Replenishing Rich Moisturizer (125gm)",UK,post_excerpt,,origin_specific_safe_text,"Buy Simple Kind to Skin Replenishing Rich Moisturizer (125gm) in Bangladesh. 100% authentic Korea import. Dhaka 1-2 days delivery. COD available at Emart Skincare Bangladesh.","Buy Simple Kind to Skin Replenishing Rich Moisturizer (125gm) in Bangladesh. 100% authentic UK-origin product. Dhaka 1-2 days delivery. COD available at Emart Skincare Bangladesh."
planned_update,26501,simple-protect-n-glow-rest-and-reset-72h-hydrating-gel-50ml,"Simple Protect ‚ÄòN‚Äô Glow rest and reset 72h hydrating gel (50ml)",UK,post_excerpt,,origin_specific_safe_text,"Buy Simple Protect ‚ÄòN‚Äô Glow rest and reset 72h hydrating gel (50ml) in Bangladesh. 100% authentic Korea import. Dhaka 1-2 days delivery. COD available at Emart Skincare Bang...","Buy Simple Protect ‚ÄòN‚Äô Glow rest and reset 72h hydrating gel (50ml) in Bangladesh. 100% authentic UK-origin product. Dhaka 1-2 days delivery. COD available at Emart Skincare..."
planned_update,27212,the-inkey-list-salicylic-acid-cleanser-150ml,"THE INKEY LIST Salicylic Acid Cleanser 150ml",UK,post_excerpt,,origin_specific_safe_text,"Buy THE INKEY LIST Salicylic Acid Cleanser 150ml in Bangladesh. 100% authentic Korea import. Dhaka 1-2 days delivery. COD available at Emart Skincare Bangladesh.","Buy THE INKEY LIST Salicylic Acid Cleanser 150ml in Bangladesh. 100% authentic UK-origin product. Dhaka 1-2 days delivery. COD available at Emart Skincare Bangladesh."
planned_update,27227,the-inkey-list-succinic-acid-blemish-treatment-15ml,"The INKEY List Succinic Acid Acne Blemish Treatment Gel 15ml",UK,post_content,,origin_specific_safe_text,"Some products are so good that you never want to stop using them once you start. The INKEY List Succinic Acid Acne Blemish Treatment Gel is one such gem. Specially designed to t...","Some products are so good that you never want to stop using them once you start. The INKEY List Succinic Acid Acne Blemish Treatment Gel is one such gem. Specially designed to t..."
planned_update,27227,the-inkey-list-succinic-acid-blemish-treatment-15ml,"The INKEY List Succinic Acid Acne Blemish Treatment Gel 15ml",UK,post_excerpt,,origin_specific_safe_text,"Buy The INKEY List Succinic Acid Acne Blemish Treatment Gel 15ml in Bangladesh. 100% authentic Korea import. Dhaka 1-2 days delivery. COD available at Emart Skincare Bangladesh.","Buy The INKEY List Succinic Acid Acne Blemish Treatment Gel 15ml in Bangladesh. 100% authentic UK-origin product. Dhaka 1-2 days delivery. COD available at Emart Skincare Bangla..."
planned_update,27228,the-inkey-list-lactic-acid-serum-30ml,"The INKEY List Lactic Acid Serum 30ml",UK,post_content,,origin_specific_safe_text,"Honestly, we‚Äôre pretty impressed with this product. The INKEY List Lactic Acid Serum is a for anyone looking to achieve brighter, smoother skin without harsh treatments. Desig...","Honestly, we‚Äôre pretty impressed with this product. The INKEY List Lactic Acid Serum is a for anyone looking to achieve brighter, smoother skin without harsh treatments. Desig..."
planned_update,27228,the-inkey-list-lactic-acid-serum-30ml,"The INKEY List Lactic Acid Serum 30ml",UK,post_excerpt,,origin_specific_safe_text,"Buy The INKEY List Lactic Acid Serum 30ml in Bangladesh. 100% authentic Korea import. Dhaka 1-2 days delivery. COD available at Emart Skincare Bangladesh.","Buy The INKEY List Lactic Acid Serum 30ml in Bangladesh. 100% authentic UK-origin product. Dhaka 1-2 days delivery. COD available at Emart Skincare Bangladesh."
planned_update,31919,technic-almond-24-false-nails-with-glue-gloss-purple,"Technic Almond 24 False Nails With Glue - Gloss Purple",UK,post_excerpt,,origin_specific_safe_text,"Buy Technic Almond 24 False Nails With Glue - Gloss Purple in Bangladesh. 100% authentic Korea import. Dhaka 1-2 days delivery. COD available at Emart Skincare Bangladesh.","Buy Technic Almond 24 False Nails With Glue - Gloss Purple in Bangladesh. 100% authentic UK-origin product. Dhaka 1-2 days delivery. COD available at Emart Skincare Bangladesh."
planned_update,31924,technic-stiletto-24-false-nails-with-glue-gloss-red,"Technic Stiletto 24 False Nails With Glue - Gloss Red",UK,post_content,,origin_specific_safe_text,"Hey lovelies, Riya here! The Emart team personally verify ‡¶ï‡¶∞‡ßá‡¶õ‡ßá this gorgeous Technic Stiletto 24 False Nails With Glue - Gloss Red from Korea, and trust me, it‚Äôs a ...","Hey lovelies, Riya here! The Emart team personally verify ‡¶ï‡¶∞‡ßá‡¶õ‡ßá this gorgeous Technic Stiletto 24 False Nails With Glue - Gloss Red from Korea, and trust me, it‚Äôs a ..."
planned_update,31924,technic-stiletto-24-false-nails-with-glue-gloss-red,"Technic Stiletto 24 False Nails With Glue - Gloss Red",UK,post_excerpt,,origin_specific_safe_text,"Buy Technic Stiletto 24 False Nails With Glue - Gloss Red in Bangladesh. 100% authentic Korea import. Dhaka 1-2 days delivery. COD available at Emart Skincare Bangladesh.","Buy Technic Stiletto 24 False Nails With Glue - Gloss Red in Bangladesh. 100% authentic UK-origin product. Dhaka 1-2 days delivery. COD available at Emart Skincare Bangladesh."
planned_update,31925,technic-squareletto-24-false-nails-with-glue-rose-gold-glitter,"Technic Squareletto 24 False Nails With Glue - Rose Gold Glitter",UK,post_content,,origin_specific_safe_text,"‡¶Ü‡¶Æ‡¶æ‡¶¶‡ßá‡¶∞ ‡¶è‡¶ï‡¶ú‡¶® customer ‡¶™‡ßç‡¶∞‡¶•‡¶Æ ‡¶è‡¶á ‡¶™‡¶£‡ßç‡¶Ø‡¶ü‡¶æ‡¶∞ ‡¶ï‡¶•‡¶æ ‡¶¨‡¶≤‡ßá‡¶õ‡¶ø‡¶≤‡ßá‡¶®‡•§ Technic Squareletto 24 False Nails With Glue - Rose G...","‡¶Ü‡¶Æ‡¶æ‡¶¶‡ßá‡¶∞ ‡¶è‡¶ï‡¶ú‡¶® customer ‡¶™‡ßç‡¶∞‡¶•‡¶Æ ‡¶è‡¶á ‡¶™‡¶£‡ßç‡¶Ø‡¶ü‡¶æ‡¶∞ ‡¶ï‡¶•‡¶æ ‡¶¨‡¶≤‡ßá‡¶õ‡¶ø‡¶≤‡ßá‡¶®‡•§ Technic Squareletto 24 False Nails With Glue - Rose G..."
planned_update,31925,technic-squareletto-24-false-nails-with-glue-rose-gold-glitter,"Technic Squareletto 24 False Nails With Glue - Rose Gold Glitter",UK,post_excerpt,,origin_specific_safe_text,"Buy Technic Squareletto 24 False Nails With Glue - Rose Gold Glitter in Bangladesh. 100% authentic Korea import. Dhaka 1-2 days delivery. COD available at Emart Skincare Banglad...","Buy Technic Squareletto 24 False Nails With Glue - Rose Gold Glitter in Bangladesh. 100% authentic UK-origin product. Dhaka 1-2 days delivery. COD available at Emart Skincare Ba..."
planned_update,31935,technic-theglitz-liquid-glitter-eyeshadow-black-5ml,"Technic TheGlitz Liquid Glitter Eyeshadow (Black) - 5ml",UK,post_excerpt,,origin_specific_safe_text,"Buy Technic TheGlitz Liquid Glitter Eyeshadow (Black) - 5ml in Bangladesh. 100% authentic Korea import. Dhaka 1-2 days delivery. COD available at Emart Skincare Bangladesh.","Buy Technic TheGlitz Liquid Glitter Eyeshadow (Black) - 5ml in Bangladesh. 100% authentic UK-origin product. Dhaka 1-2 days delivery. COD available at Emart Skincare Bangladesh."
planned_update,31944,maybelline-fit-me-matte-liquid-foundation-spf22-classic-ivory-120-30ml,"Maybelline Fit Me Matte Liquid Foundation SPF22 - Classic Ivory 120 - 30ml",USA,post_content,,origin_specific_safe_text,"Made with Bangladesh's weather and skin in mind, the Maybelline Fit Me Matte Liquid Foundation SPF22 - Classic Ivory 120 is a for anyone looking for a flawless matte finish. Des...","Made with Bangladesh's weather and skin in mind, the Maybelline Fit Me Matte Liquid Foundation SPF22 - Classic Ivory 120 is a for anyone looking for a flawless matte finish. Des..."
planned_update,31944,maybelline-fit-me-matte-liquid-foundation-spf22-classic-ivory-120-30ml,"Maybelline Fit Me Matte Liquid Foundation SPF22 - Classic Ivory 120 - 30ml",USA,post_excerpt,,origin_specific_safe_text,"Buy Maybelline Fit Me Matte Liquid Foundation SPF22 - Classic Ivory 120 - 30ml in Bangladesh. 100% authentic Korea import. Dhaka 1-2 days delivery. COD available at Emart Skinca...","Buy Maybelline Fit Me Matte Liquid Foundation SPF22 - Classic Ivory 120 - 30ml in Bangladesh. 100% authentic USA-origin product. Dhaka 1-2 days delivery. COD available at Emart ..."
planned_update,31947,maybelline-fit-me-matte-liquid-foundation-spf22-wram-nude-128-30ml,"Maybelline Fit Me Matte Liquid Foundation SPF22 - Wram Nude 128 - 30ml",USA,post_content,,origin_specific_safe_text,"Emart team ‡¶è‡¶á ‡¶™‡¶£‡ßç‡¶Ø‡¶ü‡¶æ personally test ‡¶ï‡¶∞‡ßá‡¶õ‡ßá! If you're looking for a foundation that keeps up with Dhaka's humidity, heat, and pollution while giving yo...","Emart team ‡¶è‡¶á ‡¶™‡¶£‡ßç‡¶Ø‡¶ü‡¶æ personally test ‡¶ï‡¶∞‡ßá‡¶õ‡ßá! If you're looking for a foundation that keeps up with Dhaka's humidity, heat, and pollution while giving yo..."
planned_update,31947,maybelline-fit-me-matte-liquid-foundation-spf22-wram-nude-128-30ml,"Maybelline Fit Me Matte Liquid Foundation SPF22 - Wram Nude 128 - 30ml",USA,post_excerpt,,origin_specific_safe_text,"Buy Maybelline Fit Me Matte Liquid Foundation SPF22 - Wram Nude 128 - 30ml in Bangladesh. 100% authentic Korea import. Dhaka 1-2 days delivery. COD available at Emart Skincare B...","Buy Maybelline Fit Me Matte Liquid Foundation SPF22 - Wram Nude 128 - 30ml in Bangladesh. 100% authentic USA-origin product. Dhaka 1-2 days delivery. COD available at Emart Skin..."
planned_update,31950,maybelline-fit-me-matte-liquid-foundation-spf22-natural-beige-220-30ml,"Maybelline Fit Me Matte Liquid Foundation SPF22 - Natural Beige 220 - 30ml",USA,post_excerpt,,origin_specific_safe_text,"Buy Maybelline Fit Me Matte Liquid Foundation SPF22 - Natural Beige 220 - 30ml in Bangladesh. 100% authentic Korea import. Dhaka 1-2 days delivery. COD available at Emart Skinca...","Buy Maybelline Fit Me Matte Liquid Foundation SPF22 - Natural Beige 220 - 30ml in Bangladesh. 100% authentic USA-origin product. Dhaka 1-2 days delivery. COD available at Emart ..."
planned_update,31953,maybelline-fit-me-matte-liquid-foundation-spf22-ivory-115-30ml,"Maybelline Fit Me Matte Liquid Foundation SPF22 - Ivory 115 - 30ml",USA,post_content,,origin_specific_safe_text,"Korean skincare has always been a favorite in Bangladeshi beauty routines, and after testing numerous products, Maybelline‚Äôs Fit Me Matte Liquid Foundation SPF22 has earned it...","Korean skincare has always been a favorite in Bangladeshi beauty routines, and after testing numerous products, Maybelline‚Äôs Fit Me Matte Liquid Foundation SPF22 has earned it..."
planned_update,31953,maybelline-fit-me-matte-liquid-foundation-spf22-ivory-115-30ml,"Maybelline Fit Me Matte Liquid Foundation SPF22 - Ivory 115 - 30ml",USA,post_excerpt,,origin_specific_safe_text,"Buy Maybelline Fit Me Matte Liquid Foundation SPF22 - Ivory 115 - 30ml in Bangladesh. 100% authentic Korea import. Dhaka 1-2 days delivery. COD available at Emart Skincare Bangl...","Buy Maybelline Fit Me Matte Liquid Foundation SPF22 - Ivory 115 - 30ml in Bangladesh. 100% authentic USA-origin product. Dhaka 1-2 days delivery. COD available at Emart Skincare..."
planned_update,32647,athena-beauty-cosmetic-pads-120pcs,"Athena Beauty Cosmetic Pads 120pcs",China,post_content,,origin_specific_safe_text,"‡¶¨‡¶æ‡¶Ç‡¶≤‡¶æ‡¶¶‡ßá‡¶∂‡ßá‡¶∞ ‡¶Ü‡¶¨‡¶π‡¶æ‡¶ì‡¶Ø‡¶º‡¶æ ‡¶Ü‡¶∞ ‡¶§‡ßç‡¶¨‡¶ï‡ßá‡¶∞ ‡¶ï‡¶•‡¶æ ‡¶Æ‡¶æ‡¶•‡¶æ‡¶Ø‡¶º ‡¶∞‡ßá‡¶ñ‡ßá‡¶á ‡¶è‡¶ü‡¶æ ‡¶Ü‡¶®‡¶æ ‡¶π‡¶Ø‡¶º‡ßá‡¶õ‡ßá‡•§ Living i...","‡¶¨‡¶æ‡¶Ç‡¶≤‡¶æ‡¶¶‡ßá‡¶∂‡ßá‡¶∞ ‡¶Ü‡¶¨‡¶π‡¶æ‡¶ì‡¶Ø‡¶º‡¶æ ‡¶Ü‡¶∞ ‡¶§‡ßç‡¶¨‡¶ï‡ßá‡¶∞ ‡¶ï‡¶•‡¶æ ‡¶Æ‡¶æ‡¶•‡¶æ‡¶Ø‡¶º ‡¶∞‡ßá‡¶ñ‡ßá‡¶á ‡¶è‡¶ü‡¶æ ‡¶Ü‡¶®‡¶æ ‡¶π‡¶Ø‡¶º‡ßá‡¶õ‡ßá‡•§ Living i..."
planned_update,32647,athena-beauty-cosmetic-pads-120pcs,"Athena Beauty Cosmetic Pads 120pcs",China,post_excerpt,,origin_specific_safe_text,"Buy Athena Beauty Cosmetic Pads 120pcs in Bangladesh. 100% authentic Korea import. Dhaka 1-2 days delivery. COD available at Emart Skincare Bangladesh.","Buy Athena Beauty Cosmetic Pads 120pcs in Bangladesh. 100% authentic China-origin product. Dhaka 1-2 days delivery. COD available at Emart Skincare Bangladesh."
planned_update,33893,clean-clear-oil-free-micellar-water-with-aloe-extract-100ml,"Clean & Clear Oil Free Micellar Water with Aloe Extract 100ml",USA,post_content,,origin_specific_safe_text,"Some products make you fall in love at first use‚ÄîClean &amp; Clear Oil Free Micellar Water with Aloe Extract is one of them. Living in Dhaka means battling humidity, pollution...","Some products make you fall in love at first use‚ÄîClean &amp; Clear Oil Free Micellar Water with Aloe Extract is one of them. Living in Dhaka means battling humidity, pollution..."
planned_update,33893,clean-clear-oil-free-micellar-water-with-aloe-extract-100ml,"Clean & Clear Oil Free Micellar Water with Aloe Extract 100ml",USA,post_excerpt,,origin_specific_safe_text,"Buy Clean &amp; Clear Oil Free Micellar Water with Aloe Extract 100ml in Bangladesh. 100% authentic Korea import. Dhaka 1-2 days delivery. COD available at Emart Skincare Bangla...","Buy Clean &amp; Clear Oil Free Micellar Water with Aloe Extract 100ml in Bangladesh. 100% authentic USA-origin product. Dhaka 1-2 days delivery. COD available at Emart Skincare ..."
planned_update,34069,the-body-shop-guarana-coffee-energising-cleanser-for-men-150ml,"The Body Shop Guarana & Coffee Energising Cleanser For Men - 150ml",UK,post_content,,origin_specific_safe_text,"One of our customers first told us about this product, and since then, it has become a favorite among many men in Dhaka. The Body Shop Guarana &amp; Coffee Energising Cleanser F...","One of our customers first told us about this product, and since then, it has become a favorite among many men in Dhaka. The Body Shop Guarana &amp; Coffee Energising Cleanser F..."
planned_update,34069,the-body-shop-guarana-coffee-energising-cleanser-for-men-150ml,"The Body Shop Guarana & Coffee Energising Cleanser For Men - 150ml",UK,post_excerpt,,origin_specific_safe_text,"Buy The Body Shop Guarana &amp; Coffee Energising Cleanser For Men - 150ml in Bangladesh. 100% authentic Korea import. Dhaka 1-2 days delivery. COD available at Emart Skincare B...","Buy The Body Shop Guarana &amp; Coffee Energising Cleanser For Men - 150ml in Bangladesh. 100% authentic UK-origin product. Dhaka 1-2 days delivery. COD available at Emart Skinc..."
planned_update,35862,farlin-baby-wet-wipes-anti-rash-85-pcs,"Farlin Baby Wet Wipes Anti rash 85 pcs",Taiwan,post_excerpt,,origin_specific_safe_text,"Buy Farlin Baby Wet Wipes Anti rash 85 pcs in Bangladesh. 100% authentic Korea import. Dhaka 1-2 days delivery. COD available at Emart Skincare Bangladesh.","Buy Farlin Baby Wet Wipes Anti rash 85 pcs in Bangladesh. 100% authentic Taiwanese product. Dhaka 1-2 days delivery. COD available at Emart Skincare Bangladesh."
planned_update,35882,dove-baby-wipes-sensitive-moisture-50-pcs,"Dove Baby Wipes Sensitive Moisture 50 pcs",USA,post_content,,origin_specific_safe_text,"Our customer first informed us about this product and its amazing benefits. With Dhaka's humid, hot, and often polluted environment, parents are always looking for gentle yet ef...","Our customer first informed us about this product and its amazing benefits. With Dhaka's humid, hot, and often polluted environment, parents are always looking for gentle yet ef..."
planned_update,35882,dove-baby-wipes-sensitive-moisture-50-pcs,"Dove Baby Wipes Sensitive Moisture 50 pcs",USA,post_excerpt,,origin_specific_safe_text,"Buy Dove Baby Wipes Sensitive Moisture 50 pcs in Bangladesh. 100% authentic Korea import. Dhaka 1-2 days delivery. COD available at Emart Skincare Bangladesh.","Buy Dove Baby Wipes Sensitive Moisture 50 pcs in Bangladesh. 100% authentic USA-origin product. Dhaka 1-2 days delivery. COD available at Emart Skincare Bangladesh."
planned_update,35940,cetaphil-baby-daily-lotion-399ml-gr,"Cetaphil Baby Daily Lotion 399ml GR",USA,post_excerpt,,origin_specific_safe_text,"Buy Cetaphil Baby Daily Lotion 399ml GR in Bangladesh. 100% authentic Korea import. Dhaka 1-2 days delivery. COD available at Emart Skincare Bangladesh.","Buy Cetaphil Baby Daily Lotion 399ml GR in Bangladesh. 100% authentic USA-origin product. Dhaka 1-2 days delivery. COD available at Emart Skincare Bangladesh."
planned_update,35942,savlon-wet-wipes-80pcs,"Savlon Wet Wipes 80Pcs",Bangladesh,post_excerpt,,origin_specific_safe_text,"Buy Savlon Wet Wipes 80Pcs in Bangladesh. 100% authentic Korea import. Dhaka 1-2 days delivery. COD available at Emart Skincare Bangladesh.","Buy Savlon Wet Wipes 80Pcs in Bangladesh. 100% authentic Bangladeshi product. Dhaka 1-2 days delivery. COD available at Emart Skincare Bangladesh."
planned_update,35946,cetaphil-baby-gentle-wash-230ml-gr,"Cetaphil Baby Gentle Wash 230ml GR",USA,post_excerpt,,origin_specific_safe_text,"Buy Cetaphil Baby Gentle Wash 230ml GR in Bangladesh. 100% authentic Korea import. Dhaka 1-2 days delivery. COD available at Emart Skincare Bangladesh.","Buy Cetaphil Baby Gentle Wash 230ml GR in Bangladesh. 100% authentic USA-origin product. Dhaka 1-2 days delivery. COD available at Emart Skincare Bangladesh."
planned_update,35961,eucerin-baby-wash-shampoo-400ml-mx,"Eucerin Baby Wash & Shampoo 400ml MX",Germany,post_excerpt,,origin_specific_safe_text,"Buy Eucerin Baby Wash &amp; Shampoo 400ml MX in Bangladesh. 100% authentic Korea import. Dhaka 1-2 days delivery. COD available at Emart Skincare Bangladesh.","Buy Eucerin Baby Wash &amp; Shampoo 400ml MX in Bangladesh. 100% authentic German product. Dhaka 1-2 days delivery. COD available at Emart Skincare Bangladesh."
planned_update,35965,ponds-magic-powder-bb-50gm-th,"Ponds Magic Powder BB 50gm.TH",USA,post_excerpt,,origin_specific_safe_text,"Buy Ponds Magic Powder BB 50gm.TH in Bangladesh. 100% authentic Korea import. Dhaka 1-2 days delivery. COD available at Emart Skincare Bangladesh.","Buy Ponds Magic Powder BB 50gm.TH in Bangladesh. 100% authentic USA-origin product. Dhaka 1-2 days delivery. COD available at Emart Skincare Bangladesh."
planned_update,35969,mamy-poko-pants-xxxl-24-pcs-18-35kg,"Mamy Poko Pants XXXL-24 Pcs (18-35Kg)",India,post_content,,origin_specific_safe_text,"The Emart team has personally tested this product, and we‚Äôre excited to share it with you! The Mamy Poko Pants XXXL-24 Pcs (18-35Kg) is a trusted choice for parents looking fo...","The Emart team has personally tested this product, and we‚Äôre excited to share it with you! The Mamy Poko Pants XXXL-24 Pcs (18-35Kg) is a trusted choice for parents looking fo..."
planned_update,35969,mamy-poko-pants-xxxl-24-pcs-18-35kg,"Mamy Poko Pants XXXL-24 Pcs (18-35Kg)",India,post_excerpt,,origin_specific_safe_text,"Buy Mamy Poko Pants XXXL-24 Pcs (18-35Kg) in Bangladesh. 100% authentic Korea import. Dhaka 1-2 days delivery. COD available at Emart Skincare Bangladesh.","Buy Mamy Poko Pants XXXL-24 Pcs (18-35Kg) in Bangladesh. 100% authentic Indian product. Dhaka 1-2 days delivery. COD available at Emart Skincare Bangladesh."
planned_update,35980,twinkle-baby-pant-diaper-large-48pcs,"Twinkle Baby Pant Diaper Large 48pcs",Bangladesh,post_content,,origin_specific_safe_text,"‡¶∏‡¶§‡ßç‡¶Ø‡¶ø ‡¶¨‡¶≤‡¶§‡ßá, ‡¶è‡¶á ‡¶™‡¶£‡ßç‡¶Ø‡¶ü‡¶æ ‡¶®‡¶ø‡¶Ø‡¶º‡ßá ‡¶Ü‡¶Æ‡¶∞‡¶æ ‡¶¨‡ßá‡¶∂ impressed‡•§ The Twinkle Baby Pant Diaper Large 48pcs is a for busy parents in Dha...","‡¶∏‡¶§‡ßç‡¶Ø‡¶ø ‡¶¨‡¶≤‡¶§‡ßá, ‡¶è‡¶á ‡¶™‡¶£‡ßç‡¶Ø‡¶ü‡¶æ ‡¶®‡¶ø‡¶Ø‡¶º‡ßá ‡¶Ü‡¶Æ‡¶∞‡¶æ ‡¶¨‡ßá‡¶∂ impressed‡•§ The Twinkle Baby Pant Diaper Large 48pcs is a for busy parents in Dha..."
planned_update,35980,twinkle-baby-pant-diaper-large-48pcs,"Twinkle Baby Pant Diaper Large 48pcs",Bangladesh,post_excerpt,,origin_specific_safe_text,"Buy Twinkle Baby Pant Diaper Large 48pcs in Bangladesh. 100% authentic Korea import. Dhaka 1-2 days delivery. COD available at Emart Skincare Bangladesh.","Buy Twinkle Baby Pant Diaper Large 48pcs in Bangladesh. 100% authentic Bangladeshi product. Dhaka 1-2 days delivery. COD available at Emart Skincare Bangladesh."
