#,brand,score,emart_sizes,emartway_sizes,emart_name,emartway_name,emart_price,emartway_price,diff_pct,emart_url,emartway_url,sale_price_applied,sale_status,wc_regular_price,wc_sale_price,wc_product_id,wc_status
302,Nivea,84.0,50ml,50ml,Nivea Refreshingly Soft Moisturizing Cream 50ml,Nivea Soft Moisturizing Cream 50ml,1100,320,243.8,https://e-mart.com.bd/shop/nivea-refreshingly-soft-moisturizing-cream-50ml,https://www.emartwayskincare.com.bd/nivea-soft-moisturizing-cream-50ml,320,applied,1100,320,37585,ok
303,Rohto Mentholatum,84.0,140ml,140ml,Rohto Mentholatum Hada Labo gokujyun premium hydrating milk 140ml,Hada Labo Gokujyun Premium Hydrating Milk Lotion 140ml,2200,1584,38.9,https://e-mart.com.bd/shop/rohto-mentholatum-hada-labo-gokujyun-premium-hydrating-milk-140ml,https://www.emartwayskincare.com.bd/hada-labo-gokujyun-premium-hydrating-milk-lotion140ml,1584,applied,2200,1584,50886,ok
304,The Face Shop,84.0,150ml,150ml,The face shop rice ceramide moisturizing toner - 150ml,The Face Shop Rice Ceramide Moisturizing Emulation 150ml,1500,1160,29.3,https://e-mart.com.bd/shop/the-face-shop-rice-ceramide-moisturizing-toner-150ml,https://www.emartwayskincare.com.bd/the-face-shop-rice-ceramide-moisturizing-emulation-150ml,1160,applied,1500,1160,58597,ok
305,Wskinlab,84.0,50ml,50ml,W.Skin Laboratory A.M Cream (Anti-Melasma) 50ml,WSKIN LAB AM Anti-Melasma Cream 50ml,1600,1290,24.0,https://e-mart.com.bd/shop/w-skin-laboratory-a-m-cream-anti-melasma-50ml,https://www.emartwayskincare.com.bd/wskin-lab-am-anti-melasma-cream-50ml,1290,applied,1600,1290,51258,ok
306,Cos De Baha,83.9,30ml,30ml,Cos De BAHA 10% Niacinamide Booster Serum with 1% Zinc 30ml (N),Cos De BAHA Niacinamide 10% Serum(N) 30ml,1100,1037,6.1,https://e-mart.com.bd/shop/cos-de-baha-10-niacinamide-booster-serum-with-1-zinc-30ml-n,https://www.emartwayskincare.com.bd/cos-de-baha-niacinamide-10-serum-30ml,1037,applied,1100,1037,92838,ok
307,Minimalist,83.9,30ml,30ml,Minimalist Tranexamic 3% Face Serum 30ml ( expire 2026/12 ),Minimalist Tranexamic 3% Face Serum 30ml,2050,1199,71.0,https://e-mart.com.bd/shop/minimalist-tranexamic-3-face-serum-30ml-expire-2026-12,https://www.emartwayskincare.com.bd/minimalist-tranexamic-3-face-serum-30ml,1199,applied,2050.0,1199,74873,ok
308,Simple,83.9,125ml,125ml,Simple Kind to Skin Hydrating Light Moisturizer 125ml,Simple Hydrating Light Moisturiser 125ml,850,690,23.2,https://e-mart.com.bd/shop/simple-kind-to-skin-hydrating-light-moisturizer-125ml,https://www.emartwayskincare.com.bd/hydrating-light-moisturiser-simple,690,applied,850.0,690,92834,ok
309,3W Clinic,83.7,150g,150g,3W Clinic Crystal White Milky lotion150g,3W CLINIC Crystal White Milky Body Lotion 150g,1300,1135,14.5,https://e-mart.com.bd/shop/3w-clinic-crystal-white-milky-lotion150g,https://www.emartwayskincare.com.bd/crystal-white-milky-body-lotions-150g-3w-clinic,1135,applied,1300,1135,52106,ok
310,Tirtir,83.6,150ml,150ml,Tirtir Milk Skin Toner Light 150ml,TIRTIR Milk Skin Rice Toner 150ml,2700,2596,4.0,https://e-mart.com.bd/shop/tirtir-milk-skin-toner-light-150ml,https://www.emartwayskincare.com.bd/tirtir-milk-skin-toner-150ml,2596,applied,2700,2596,58375,ok
311,Beaute,83.5,160ml,160ml,Melasma-X Moringa Brightening Cool Soothing Gel 160ml,Beaute Moringa Brightening Cool Soothing Gel 160ml,950,827,14.8,https://e-mart.com.bd/shop/melasma-x-moringa-brightening-cool-soothing-gel-160ml,https://www.emartwayskincare.com.bd/beaute-moringa-brightening-cool-soothing-gel,827,applied,950,827,26904,ok
312,Ryo,83.5,400ml,400ml,RYO Damage Care & Nourishing Selection Shampoo 400 ml,Ryo Damage Care & Nourishing Shampoo 400ml,2000,1980,1.0,https://e-mart.com.bd/shop/ryo-damage-care-nourishing-selection-shampoo-400-ml,https://www.emartwayskincare.com.bd/ryo-damage-care--nourishing-shampoo-400ml,1980,applied,2000,1980,60113,ok
313,Dabo,83.3,120ml,120ml,Dabo T-Tree Cica Acne Cleansing Foam 120 ml,Dabo T Treecica Acne Cleansing Foam 120ml,950,750,26.7,https://e-mart.com.bd/shop/dabo-t-tree-cica-acne-cleansing-foam-120-ml,https://www.emartwayskincare.com.bd/dabo-t-treecica-acne-cleansing-foam-120ml,750,applied,950.0,750,60228,ok
314,Raip,83.3,100ml,100ml,RAIP ARGAN OIL 100ML,RAIP R3 Argan Hair Oil (Original) 100ml,1000,840,19.0,https://e-mart.com.bd/shop/raip-argan-oil-100ml,https://www.emartwayskincare.com.bd/raip-r3-argan-hair-oil-original-100ml,840,applied,1000,840,92842,ok
315,3W Clinic,83.1,40ml,40ml,3w Clinic Collagen Eye Cream 40 ml,3W CLINIC Collagen Whitening Eye Cream 40ml,450,484,-7.0,https://e-mart.com.bd/shop/3w-clinic-collagen-eye-cream-40-ml,https://www.emartwayskincare.com.bd/3w-clinic-collagen-whitening-eye-cream-40ml,484.00,adjusted,550.00,484.00,61034,ok
316,Haruharu Wonder,83.1,120ml,120ml,Haruharu Wonder Black Rice Probiotics Barrier Essence 120ml (a.k.a. Makgeolli Essence),Haruharu Wonder Black Rice Probiotics Barrier Essence 120ml,2300,1892,21.6,https://e-mart.com.bd/shop/haruharu-wonder-black-rice-probiotics-barrier-essence-120ml-a-k-a-makgeolli-essence,https://www.emartwayskincare.com.bd/haruharu-wonder-black-rice-probiotics-barrier-essence-120ml,1892,applied,2300.0,1892,62562,ok
317,Nature Republic,83.1,300ml,300ml,Nature Republic Soothing & Moisture Aloe Vera 92% Soothing Gel 300 ml,Nature Republic Aloe Vera Gel 92 Percent Soothing Moisture 300ml,1000,827,20.8,https://e-mart.com.bd/shop/nature-republic-soothing-moisture-aloe-vera-92-soothing-gel-300-ml,https://www.emartwayskincare.com.bd/soothing-moisture-aloe-vera-gel-92-percent-nature-republic,827,applied,1000,827,2734,ok
318,Jamaican,83.0,118ml,118ml,Jamaican Black Castor Oil (Coconut) 118ml,Jamaican Mango & Lime Pure Black Castor Oil (Coconut) 118ml,1400,1232,13.6,https://e-mart.com.bd/shop/jamaican-black-castor-oil-coconut-118ml,https://www.emartwayskincare.com.bd/jamaican-mango--lime-pure-black-castor-oil-coconut-118ml,1232,applied,1400.0,1232,63599,ok
319,Anua,82.9,150ml,150ml,[ANUA] 8 HYALURONIC ACID MOISTURIZING GENTLE GEL CLEANSER 150ml,Anua 8 Hyaluronic Acid Hydrating Gentle Foaming Cleanser 150ml,1500,1360,10.3,https://e-mart.com.bd/shop/anua-8-hyaluronic-acid-moisturizing-gentle-gel-cleanser-150ml,https://www.emartwayskincare.com.bd/anua-8-hyaluronic-acid-hydrating-gentle-foaming-cleanser-150ml,1360,applied,1500.0,1360,61882,ok
320,Cos De Baha,82.8,30ml,30ml,Cos De BAHA Centella Asiatica Facial Serum (CH) 30ml,Cos De BAHA Centella HA Serum (CH) 30ml,1100,1079,1.9,https://e-mart.com.bd/shop/cos-de-baha-centella-asiatica-facial-serum-ch-30ml,https://www.emartwayskincare.com.bd/cos-de-baha-ch-centella-ha-serum-30ml,1079,applied,1100,1079,26749,ok
321,ISNTREE,82.7,100ml,100ml,Isntree Real Mugwort Clay Mask 100ml,Isntree Mugwort Calming Clay Mask - 100ml,1800,1848,-2.6,https://e-mart.com.bd/shop/isntree-real-mugwort-clay-mask-100ml,https://www.emartwayskincare.com.bd/isntree-mugwort-calming-clay-mask---100ml,1848.00,adjusted,2100.00,1848.00,4069,ok
322,Laneige,82.7,20g,20g,Laneige Lip Sleeping Mask Apple Lime 20g,LANEIGE Lip Sleeping Mask Berry 20g,1500,1390,7.9,https://e-mart.com.bd/shop/laneige-lip-sleeping-mask-apple-lime-20g,https://www.emartwayskincare.com.bd/lip-sleeping-mask-berry-laneige,,excluded,1500.0,,63525,ok
323,The Yeon,82.5,100ml,100ml,The YEON Vita7 AHA/BHA Energy Peeling Gel 100 ml,The Yeon Vita 7 Energy Peeling Gel 100ml,1500,1190,26.1,https://e-mart.com.bd/shop/the-yeon-vita7-aha-bha-energy-peeling-gel-100-ml,https://www.emartwayskincare.com.bd/the-yeon-vita-7-energy-peeling-gel-100ml,1190,applied,1500,1190,3610,ok
324,Beauty of Joseon,82.4,150ml,150ml,Beauty of Joseon Bubble Toner : Green Plum + AHA 150ml,Beauty of Joseon Green Plum Refreshing Toner AHA + BHA 150ml,1700,1590,6.9,https://e-mart.com.bd/shop/beauty-of-joseon-bubble-toner-green-plum-aha-150ml,https://www.emartwayskincare.com.bd/beauty-of-joseon-green-plum-refreshing-toner-aha--bha-150ml,1590,applied,1700,1590,4188,ok
325,Celimax,82.4,30ml,30ml,CELIMAX PORE+DARK SPOT BRIGHTENING SERUM 30ML,POUR LA PEAU Brightening Shot Serum 30ml,1900,1312,44.8,https://e-mart.com.bd/shop/celimax-poredark-spot-brightening-serum-30ml,https://www.emartwayskincare.com.bd/pour-la-peau-brightening-shot-serum-30ml,,excluded,1900.0,,61900,ok
326,M.A.C,82.4,30ml,30ml,M.A.C Studio Fix Fluid SPF 15 Foundation- NC 40 30.0 ml,MAC Studio FiX Fluid SPF 15 Foundation NC30 30ml,1540,2860,-46.2,https://e-mart.com.bd/shop/m-a-c-studio-fix-fluid-spf-15-foundation-nc-40-30-0-ml,https://www.emartwayskincare.com.bd/mac-studio-fix-fluid-spf-15-foundation-nc30-30ml,,excluded,1540,,36074,ok
327,ISNTREE,82.2,50ml,50ml,Isntree Onion Newpair Gel Cream 50mL,ISNTREE Onion Newpair B5 Ampoule 50ML,1900,1540,23.4,https://e-mart.com.bd/shop/isntree-onion-newpair-gel-cream-50ml,https://www.emartwayskincare.com.bd/isntree-onion-newpair-b5-ampoule-50ml,,excluded,1900,,92852,ok
328,innisfree,82.2,100ml,100ml,Innisfree Jeju Volcanic Pore Clay Mask 100 ml,Innisfree Super Volcanic Pore Clay Mask 100ml,1900,1674,13.5,https://e-mart.com.bd/shop/innisfree-jeju-volcanic-pore-clay-mask-100-ml,https://www.emartwayskincare.com.bd/innisfree-super-volcanic-pore-clay-mask-100ml,1674,applied,1900,1674,63521,ok
329,3W Clinic,81.8,40ml,40ml,3W Clinic Black Pearl Eye Cream 40ml,3W CLINIC Snail Eye Cream 40ml,650,484,34.3,https://e-mart.com.bd/shop/3w-clinic-black-pearl-eye-cream-40ml,https://www.emartwayskincare.com.bd/3w-clinic-snail-eye-cream-40ml,484,applied,650,484,3705,ok
330,Anua,81.8,30ml,30ml,Anua Niacinamide 10% + TXA 4% Serum 30ml,Anua 10+ Niacinamide+ 4% TXA (Tranexamic Acid) Serum 30ml,2100,1990,5.5,https://e-mart.com.bd/shop/anua-niacinamide-10-txa-4-serum-30ml,https://www.emartwayskincare.com.bd/anua-10-niacinamide-4-txatranexamic-acid-serum-30ml,1990,applied,2100,1990,57150,ok
331,Biore,81.8,70ml,70ml,Biore UV Aqua Rich Watery Gel Spf 50+PA++++ 70ml,Biore UV Aqua Rich Watery Gel Sunscreen 70ml,1800,1399,28.6,https://e-mart.com.bd/shop/biore-uv-aqua-rich-watery-gel-spf-50pa-70ml,https://www.emartwayskincare.com.bd/biore-uv-aqua-rich-watery-gel-sunscreen-90ml,1399,applied,1800.0,1399,62969,ok
332,Dabo,81.3,60ml,60ml,Dabo Natural Rich Foam Cleanser – Collagen 60 ml,Dabo Natural Rich Foam Cleanser Cucumber 60ml,450,389,15.7,https://e-mart.com.bd/shop/dabo-natural-rich-foam-cleanser-collagen-60-ml,https://www.emartwayskincare.com.bd/dabo-natural-rich-foam-cleanser-cucumber-60ml,389,applied,450.0,389,60402,ok
333,Raip,81.2,100ml,100ml,Raip R3 Argan Hair Oil 100 ml - LOVELY,RAIP R3 Argan Hair Oil (Original) 100ml,950,840,13.1,https://e-mart.com.bd/shop/raip-r3-argan-hair-oil-100-ml-lovely,https://www.emartwayskincare.com.bd/raip-r3-argan-hair-oil-original-100ml,,excluded,950,,61124,ok
334,Wskinlab,81.2,250ml,250ml,W.Skin Laboratory A.M Clearing Toner Anti-Melasma 250ml,WSKIN LAB AM Clearing Toner (Anti Melasma) 250ml,1800,1299,38.6,https://e-mart.com.bd/shop/w-skin-laboratory-a-m-clearing-toner-anti-melasma-250ml,https://www.emartwayskincare.com.bd/wskin-lab-am-boosting-serum-30ml-anti-melasma-hyj7y,1299,applied,1800,1299,51262,ok
335,Nella,81.1,50ml,50ml,Nella White Snow Fermented Underarm Whitening Cream With Green Tea 50ml,Nella Underarm Whitening Cream with Green Tea 50ml,1500,1100,36.4,https://e-mart.com.bd/shop/nella-ferment-underarm-whitening-cream-50ml,https://www.emartwayskincare.com.bd/nella-underarm-whitening-cream-with-green-tea-50ml,1100,applied,1500,1100,4139,ok
336,Rohto Mentholatum,81.1,100g,100g,Melano CC Anti-blemish Brightening Gel 100gm,Melano CC Brightening Gel 100g,2100,1927,9.0,https://e-mart.com.bd/shop/melano-cc-anti-blemish-brightening-gel-100gm,https://www.emartwayskincare.com.bd/melano-cc-brightening-gel-100g,1927,applied,2100,1927,58440,ok
337,Banila Co,81.0,7ml,7ml,Banila Co Clean It Zero Pore Clarifying Cleansing Balm - 7 ml,Banila Co Clean It Zero Cica Relief Calming Cleansing Balm 7ml,280,360,-22.2,https://e-mart.com.bd/shop/banila-co-clean-it-zero-pore-clarifying-cleansing-balm-7-ml,https://www.emartwayskincare.com.bd/clean-it-zero-cleansing-balm-purifying-7ml,360.00,adjusted,450.00,360.00,61583,ok
338,Frankly,81.0,30ml,30ml,Frankly Niacinamide 15% Zinc Beads Serum 30ml,Carenel Niacinamide 10% Zinc 1% Serum 30ml,950,990,-4.0,https://e-mart.com.bd/shop/frankly-niacinamide-15-zinc-beads-serum-30ml,https://www.emartwayskincare.com.bd/carenel-niacinamide-10-zinc-1-serum-30ml,,excluded,950.0,,62232,ok
339,Biore,80.9,130g,130g,Biore Skin Care Medicated Facial Wash Acne Care 130g,Bioré skin Facial Wash Acne Care 130g,1300,1020,27.5,https://e-mart.com.bd/shop/biore-skin-care-medicated-facial-wash-acne-care-130g,https://www.emartwayskincare.com.bd/bior-facial-wash-acne-care-130g,1020,applied,1300.0,1020,62971,ok
340,Biore,80.9,130g,130g,Biore Skin care Facial Wash Rich Moisture For Dry Skin 130g,Biore Skin Care Face Wash Moisture 130g,1300,1020,27.5,https://e-mart.com.bd/shop/biore-skin-care-facial-wash-rich-moisture-for-dry-skin-130g,https://www.emartwayskincare.com.bd/biore-skin-care-face-wash-moisture-130g,1020,applied,1300.0,1020,62975,ok
341,Medicube,80.9,40ml,40ml,APLB PDRN Vitamin C Ampoule Serum 40ml,APLB Retinol Vitamin C Vitamin E Ampoule Serum 40ml,1200,952,26.1,https://e-mart.com.bd/shop/aplb-pdrn-vitamin-c-ampoule-serum-40ml,https://www.emartwayskincare.com.bd/aplb-retinol-vitamin-c-vitamin-e-ampoule-serum-40ml,,excluded,1200,,59498,ok
342,Some By Mi,80.9,50ml,50ml,Some by mi Yuja Niacin 30 Days Blemish Care Serum 50ml,Some By Mi Yuja Niacin Anti Blemish Serum 50ml,1800,1642,9.6,https://e-mart.com.bd/shop/some-by-mi-yuja-niacin-blemish-care-serum-50ml,https://www.emartwayskincare.com.bd/some-by-mi-yuja-niacin-30-days-blemish-care-serum-50ml,1642,applied,1800,1642,2583,ok
343,CeraVe,80.8,236ml,236ml,Cerave Blemish Control Cleanser for Blemish Prone Skin 236ml,Cerave Blemish Control Cleanser 236ml (UK Version),2112,2112,0.0,https://e-mart.com.bd/shop/cerave-blemish-control-cleanser-for-blemish-prone-skin-236ml,https://www.emartwayskincare.com.bd/cerave-blemish-control-cleanser-236ml-uk-version,2112,applied,2112,,63437,ok_same_price
344,Hada Labo,80.7,100g,100g,Rohto Hada Labo Gokujyun Aging care Perfect Gel (MOISTURISER) 100g,Hada Labo Koi-Gokujyun Aging Care Perfect Gel 100g,2400,2156,11.3,https://e-mart.com.bd/shop/rohto-hada-labo-gokujyun-aging-care-perfect-gel-moisturiser-100g,https://www.emartwayskincare.com.bd/hadalabo-koi-gokujyun-aging-care-perfect-gel-100g,2156,applied,2400.0,2156,62947,ok
345,Rohto Mentholatum,80.7,20ml,20ml,Rohto Melano CC Intensive Anti-Spot Premium Essence 20ml,Melano CC Intensive Anti-Spot Essence Vitamin C Serum 20ml,1900,1350,40.7,https://e-mart.com.bd/shop/rohto-melano-cc-intensive-anti-spot-premium-essence-20ml,https://www.emartwayskincare.com.bd/melano-cc-intensive-anti-spot-essence-vitamin-c-serum-20ml,1350,applied,1900.0,1350,62725,ok
346,The Face Shop,80.7,150ml,150ml,The Face Shop Rice Water Bright Rice Bran Foaming Cleanser (Dragons) 150 ml,The Face Shop Rice Water Bright Foaming Cleanser 150ml,950,899,5.7,https://e-mart.com.bd/shop/the-face-shop-rice-water-bright-rice-bran-foaming-cleanser-dragons-150-ml,https://www.emartwayskincare.com.bd/the-face-shop-rice-water-bright-foaming-cleanser-150ml,899,applied,950,899,61248,ok
347,Cosrx,80.6,65ml,65ml,COSRX Full Fit Propolis Light Cream 65 ml,Cosrx Propolis Light Cream 65ml,1900,1150,65.2,https://e-mart.com.bd/shop/cosrx-full-fit-propolis-light-cream-65-ml,https://www.emartwayskincare.com.bd/cosrx-propolis-light-cream-65ml,1150,applied,1900,1150,4326,ok
348,APLB,80.5,55ml,55ml,APLB PDRN Vitamin C Facial Cream 55ml,APLB Retinol Vitamin C Vitamin E Facial Cream 55ml,1200,935,28.3,https://e-mart.com.bd/shop/aplb-pdrn-vitamin-c-facial-cream-55ml,https://www.emartwayskincare.com.bd/aplb-retinol-vitamin-c-vitamin-e-facial-cream-55ml,,excluded,1200.0,,62358,ok
349,Missha,80.5,70ml,70ml,Missha Water Proof Sun Milk SPF50+ PA++++ 70 ml,Missha Waterproof Sun Milk SPF50+/PA+++ 70ml,1300,1170,11.1,https://e-mart.com.bd/shop/missha-water-proof-sun-milk-spf50-pa-70-ml,https://www.emartwayskincare.com.bd/waterproof-sun-milk-spf50pa-missha,1170,applied,1300,1170,60966,ok
350,Farmstay,80.4,100ml,100ml,Farm Stay Hyaluronic Acid Super Aqua Cream 100ml,Isntree Hyaluronic Acid Aqua Gel Cream 100ml,1300,1452,-10.5,https://e-mart.com.bd/shop/farm-stay-hyaluronic-acid-super-aqua-cream-100ml,https://www.emartwayskincare.com.bd/isntree-hyaluronic-acid-moist-cream-100ml,1452.00,adjusted,1650.00,1452.00,62833,ok
351,APLB,80.0,105ml,105ml,APLB Glutathione Niacinamide Mist Essence 105ml,APLB Glutathione Niacinamide Cleansing Oil 105ml,1300,1105,17.6,https://e-mart.com.bd/shop/aplb-glutathione-niacinamide-mist-essence-105ml,https://www.emartwayskincare.com.bd/aplb-glutathione-niacinamide-sunscreen-spf50-pa-105ml,1105,applied,1300.0,1105,62514,ok
352,APLB,80.0,55ml,55ml,APLB Zinc Niacinamide Facial Cream 55ml,APLB Glutathione Niacinamide Facial Cream 55ml,1200,999,20.1,https://e-mart.com.bd/shop/aplb-zinc-niacinamide-facial-cream-55ml,https://www.emartwayskincare.com.bd/aplb-glutathione-niacinamide-facial-cream-55ml,999,applied,1200.0,999,62388,ok
353,Claires,80.0,70g,70g,Claire's Guerisson 9 Complex Cream 70g,Guerisson 9 Complex Lifting Cream 70g,1550,1296,19.6,https://e-mart.com.bd/shop/claires-guerisson-9-complex-cream-70g,https://www.emartwayskincare.com.bd/guerisson-9-complex-lifting-cream,1296,applied,1550,1296,26621,ok
354,Dabo,80.0,120ml,120ml,Dabo All In One Black Snail Foam Cleanser 120 ml,Dabo Black Force For Men Foam Cleanser 120ml,850,660,28.8,https://e-mart.com.bd/shop/dabo-all-in-one-black-snail-foam-cleanser-120-ml,https://www.emartwayskincare.com.bd/dabo-black-force-for-men-foam-cleanser-120ml,660,applied,850.0,660,60190,ok
355,Dabo,80.0,100ml,100ml,Dabo Rice Ferment Foam Cleanser Whitening &#038; Shining 100ml,Dabo Whitening & Shining Rice Ferment Foam Face Wash 100ml,550,510,7.8,https://e-mart.com.bd/shop/dabo-rice-ferment-foam-cleanser-whitening-shining-100ml,https://www.emartwayskincare.com.bd/dabo-whitening--shining-rice-ferment-foam-face-wash-100ml,510,applied,550.0,510,61872,ok
356,Dabo,80.0,180ml,180ml,Dabo Rice Ferment Foam Cleanser Whitening &#038; Shining 180ml,Dabo Whitening & Shining Rice Ferment Foam Face Wash 180ml,900,918,-2.0,https://e-mart.com.bd/shop/dabo-rice-ferment-foam-cleanser-whitening-shining-180ml,https://www.emartwayskincare.com.bd/dabo-whitening--shining-rice-ferment-foam-face-wash-180ml,918.00,adjusted,1080.00,918.00,61874,ok
357,Hada Labo,80.0,100g,100g,HadaLabo koi-Gokujyun Perfect Gel (Moisturiser) 100g,Hada Labo Gokujyun Perfect Gel 100g,2250,1980,13.6,https://e-mart.com.bd/shop/hadalabo-koi-gokujyun-perfect-gel-moisturiser-100g,https://www.emartwayskincare.com.bd/hada-labo-gokujyun-perfect-gel-100g,1980,applied,2250.0,1980,62945,ok
358,Haruharu Wonder,80.0,30ml,30ml,HaruHaru Wonder Black Rice Serum 30ml,HaruHaru Wonder Black Rice Hyaluronic Toner 30ml,1700,792,114.6,https://e-mart.com.bd/shop/haruharu-wonder-black-rice-serum-30ml,https://www.emartwayskincare.com.bd/haruharu-wonder-black-rice-hyaluronic-toner-30ml,,excluded,1700.0,,63553,ok
359,Cos De Baha,98.6,,30ml,Cos De BAHA Alcohol Free Acne Treatment Intensive Facial Serum (AC) 30,Cos De BAHA Alcohol Free Acne Treatment Intensive Facial Serum (AC) 30ml,1300,1080,20.4,https://e-mart.com.bd/shop/cos-de-baha-alcohol-free-acne-treatment-intensive-facial-serum-ac-60ml,https://www.emartwayskincare.com.bd/cos-de-baha-alcohol-free-acne-treatment-intensive-facial-serum-ac---30ml,1080,applied,1300,1080,43762,ok
360,Mixsoon,98.4,,195ml,MIXSOON Bean Cleansing Oil 195m,MIXSOON Bean Cleansing Oil 195ml,1900,1657,14.6,https://e-mart.com.bd/shop/mixsoon-bean-cleansing-oil-195m,https://www.emartwayskincare.com.bd/mixsoon-bean-cleansing-oil-195ml,1657,applied,1900,1657,56306,ok
361,Insight,97.0,,,Insight Ultrathin Foundation-LN13,Insight Ultrathin Foundation-LN15,395,284,38.9,https://e-mart.com.bd/shop/insight-ultrathin-foundation-ln13,https://www.emartwayskincare.com.bd/insight-ultrathin-foundation-ln15,284,applied,395.0,284,74583,ok
362,Beauty Formulas,95.9,20pc,,Beauty Formulas Argan OIl Wax Strips Hair Remover Legs & Body 20pc,Beauty Formulas Argan Oil Wax Strips Hair Remover Legs & Body,275,372,-26.1,https://e-mart.com.bd/shop/beauty-formulas-argan-oil-wax-strips-hair-remover-legs-body-20pc,https://www.emartwayskincare.com.bd/beauty-formulas-argan-oil-wax-strips-hair-remover-legs--body,372.00,adjusted,400.00,372.00,37986,ok
363,APLB,95.1,30pc,,Aplb Retinol Vitamin C Vitamin E Beauty Tablet 30 Pcs,APLB Retinol Vitamin C Vitamin E Beauty 30 Tablets,1000,1020,-2.0,https://e-mart.com.bd/shop/aplb-retinol-vitamin-c-vitamin-e-beauty-tablet-30-pcs,https://www.emartwayskincare.com.bd/aplb-retinol-vitamin-c-vitamin-e-beauty-30-tablets,1020.00,adjusted,1200.00,1020.00,60909,ok
364,Purito Seoul,95.0,,60ml,Purito Seoul Daily Soft Touch Sunscreen SPF50+ PA++++,Purito Seoul Daily Soft Touch Sunscreen SPF50+ PA++++ 60ml,1900,1572,20.8,https://e-mart.com.bd/shop/purito-daily-go-to-sunscreen-60ml,https://www.emartwayskincare.com.bd/purito-seoul-daily-soft-touch-sunscreen-spf50-pa-60ml,1572,applied,1900,1572,2964,ok
365,APLB,94.7,30pc,,Aplb Glutathione Niacinamide Beauty Tablet 30 pcs,APLB Glutathione Niacinamide Beauty 30 Tablets,950,1020,-6.9,https://e-mart.com.bd/shop/aplb-glutathione-niacinamide-beauty-tablet-30-pcs,https://www.emartwayskincare.com.bd/aplb-glutathione-niacinamide-beauty-30-tablets,1020.00,adjusted,1200.00,1020.00,61765,ok
366,3W Clinic,94.6,50g,,3W Clinic Crystal White Milky Cream 50g,3W Clinic Crystal White Milky Cream,950,968,-1.9,https://e-mart.com.bd/shop/3w-clinic-crystal-white-milky-cream-50g,https://www.emartwayskincare.com.bd/3w-clinic-crystal-white-milky-cream,968.00,adjusted,1100.00,968.00,38306,ok
367,Ryo,94.6,480ml,,Ryo Hair Strengthen & Volume Shampoo – Floral Woody Powdery Scent 480 ml,Ryo Hair Strengthen & Volume Shampoo – Floral Woody Powdery Scent,2320,2288,1.4,https://e-mart.com.bd/shop/ryo-hair-strengthen-volume-shampoo-floral-woody-powdery-scent-480-ml,https://www.emartwayskincare.com.bd/ryo-hair-strengthen--volume-shampoo--floral-woody-powdery-scent,2288,applied,2320.0,2288,60374,ok
368,vaseline,94.2,,200ml,Vaseline Body Lotion Intensive Care Cocoa Radiant,Vaseline Intensive Care Cocoa Radiant Body Lotion 200ml,500,640,-21.9,https://e-mart.com.bd/shop/vaseline-body-lotion-intensive-care-cocoa-radiant,https://www.emartwayskincare.com.bd/vaseline-intensive-care-cocoa-radiant-body-lotion-200ml,640.00,adjusted,730.00,640.00,48689,ok
369,Christian Dean,94.1,,70ml,Christian Dean Secret Tone-up Sun Cream SPF 50+ PA+++,Christian Dean Secret Tone-Up Sun Cream SPF50+ PA+++ 70ml,600,399,50.4,https://e-mart.com.bd/shop/christian-dean-secret-tone-up-sun-cream-spf-50-pa,https://www.emartwayskincare.com.bd/christian-dean-secret-tone-up-sun-cream-spf50-pa-70ml,399,applied,600.0,399,62925,ok
370,Numbuzin,94.1,30ml,,Numbuzin No.5+ Vitamin Concentrated Serum 30ml,NUMBUZIN No.5 Vitamin Concentrated Serum,2300,1891,21.6,https://e-mart.com.bd/shop/numbuzin-no-5-vitamin-concentrated-serum-30ml,https://www.emartwayskincare.com.bd/numbuzin-no5-vitamin-concentrated-serum,1891,applied,2300,1891,56208,ok
371,vaseline,93.8,,20g,Vaseline Lip Therapy – Rosy Lips,Vaseline Lip Therapy Rosy Lips 20g,250,255,-2.0,https://e-mart.com.bd/shop/vaseline-lip-therapy-rosy-lips,https://www.emartwayskincare.com.bd/lips-like-rose-vaseline-lip-therapy-rosy-lips,255.00,adjusted,300.00,255.00,48655,ok
372,Acwell,93.6,,150ml,ACWELL Licorice pH Balancing Cleansing Toner,Acwell Licorice PH Balancing Cleansing Toner 150ml,1500,1496,0.3,https://e-mart.com.bd/shop/acwell-licorice-ph-balancing-cleansing-toner,https://www.emartwayskincare.com.bd/acwell-licorice-ph-balancing-cleansing-toner-150ml,1496,applied,1500,1496,3750,ok
373,Etude House,93.5,,,Etude House Dear Darling Water Tint #02 Cherry Ade,ETUDE DEAR DARLING WATER TINT #02 Cherry Ade,650,604,7.5,https://e-mart.com.bd/shop/etude-house-dear-darling-water-tint-02-cherry-ade,https://www.emartwayskincare.com.bd/etude-dear-darling-water-tint-red-grapefruit,604,applied,650.0,604,63367,ok
374,Anua,93.3,,30ml,ANUA RETINOL 0.3 + NIACIN RENEWING SERUM 30m,ANUA Nano Retinol 0.3+Niacin Renewing Serum 30ml,2500,2422,3.2,https://e-mart.com.bd/shop/anua-retinol-0-3-niacin-renewing-serum-30m,https://www.emartwayskincare.com.bd/anua-nano-retinol-03-niacin-renewing-serum-30ml,2422,applied,2500,2422,92910,ok
375,NEOGEN,93.3,80ml,,Neogen Dermalogy Black Energy Cream 80ml,NEOGEN Dermalogy Black Energy Cream,2000,1936,3.3,https://e-mart.com.bd/shop/neogen-dermalogy-black-energy-cream-80ml,https://www.emartwayskincare.com.bd/neogen-dermalogy-black-energy-cream,1936,applied,2000,1936,3965,ok
376,Dabo,92.5,,80ml,DABO 7 in 1 Moisture Sherbet Cream,Dabo 7 In 1 Moisture Sherbet Cream 80ml,1100,820,34.1,https://e-mart.com.bd/shop/dabo-7-in-1-moisture-sherbet-cream,https://www.emartwayskincare.com.bd/dabo-7-in-1-moisture-sherbet-cream-80ml,820,applied,1100.0,820,60216,ok
377,Dabo,92.3,,80ml,DABO 7 in 1 Nutrition Amino Cream,DABO 7 in 1 Nutrition Amino Cream 80ml,1100,820,34.1,https://e-mart.com.bd/shop/dabo-7-in-1-nutrition-amino-cream,https://www.emartwayskincare.com.bd/dabo-7-in-1-nutrition-amino-cream-80ml,820,applied,1100.0,820,60400,ok
378,Cetaphil,91.5,,550g,Cetaphil Moisturising Cream,Cetaphil Moisturising Cream 550g,900,2640,-65.9,https://e-mart.com.bd/shop/cetaphil-moisturising-cream,https://www.emartwayskincare.com.bd/cetaphil-moisturising-cream-550g,,excluded,900,,60839,ok
379,Beauty of Joseon,90.2,,,Beauty of Joseon Hanbang Serum Discovery Kit ( 4 serum),Beauty of Joseon Hanbang Serum Discovery Kit,1900,2082,-8.8,https://e-mart.com.bd/shop/beauty-of-joseon-hanbang-serum-discovery-kit-4-serum,https://www.emartwayskincare.com.bd/beauty-of-joseon-hanbang-serum-discovery-kit,2082.50,adjusted,2450.00,2082.50,50515,ok
